no;doc_id;province;source_web;url;key_word;date_access;species;news_publish;news_title;news_content;clean_date;;
251;N257;bali;detik_bali;https://www.detik.com/bali/berita/d-7174289/kasus-asf-muncul-lagi-di-badung-peternak-babi-wajib-waspada;"""babi"" ""mati"" ""2024""";27/09/2024;domestic;Jumat, 02 Feb 2024 20:57 WIB;Kasus ASF Muncul Lagi di Badung, Peternak Babi Wajib Waspada!;;02/02/2024;;
252;N258;ntt;detik_bali;https://www.detik.com/bali/nusra/d-7172968/74-babi-di-sikka-ntt-mati-terserang-asf;"""babi"" ""mati"" ""2024""";27/09/2024;domestic;Jumat, 02 Feb 2024 10:10 WIB;74 Babi di Sikka NTT Mati Terserang ASF;Download Apps Detikcom Sekarang https://apps.detik.com/detik/;02/02/2024;;
253;N259;bali;tribun_bali;https://bali.tribunnews.com/2024/03/18/puluhan-babi-warga-mati-diduga-terjangkit-virus-asf?page=all;"""babi"" ""mati"" ""2024""";27/09/2024;domestic;Tayang: Senin, 18 Maret 2024 20:24 WITA;Puluhan Babi Warga Mati, Diduga Terjangkit Virus ASF;Padahal katanya, sejak beberapa tahun lalu Pemkab Mimika telah menerbitkan regulasi larangan babi dan berbagai olahannya didatangkan dari luar Kabupaten Mimika.;18/03/2024;;
254;N260;papua tengah;tribun;https://www.tribunnews.com/regional/2024/01/30/245-ekor-ternak-babi-di-timika-mati-diserang-virus-asf-peternak-dilarang-jual-hewan-sakit;"""babi"" ""mati"" ""2024""";27/09/2024;domestic;Tayang: Selasa, 30 Januari 2024 15:49 WIB;245 Ekor Ternak Babi di Timika Mati Diserang Virus ASF, Peternak Dilarang Jual Hewan Sakit;"TRIBUNNEWS.COM, TIMIKA- Sedikitnya 245 ekor ternak babi mati akibat terserang Virus African Swine Fever (ASF) di wilayah Kota Timika, KabupatenMimika, Provinsi Papua Tengah. ""Jadi sesuai uji laboratorium Loka Vet di Jayapura diketahui ternak babi di Timika positif ASF,"" ujar Kepala Dinas Peternakan dan Kesehatan Hewan Kabupaten Mimika, Provinsi Papua Tengah, drh Sabelina Fitriani kepada Tribun-Papua.com, Selasa (30/1/2024). drh Sabelina Fitriani menjelaskan, awalnya ditemukan ternak babi mati di Jalan Baru pada Selasa (23/1/2024) milik salah satu warga. ""Dari Jalan Baru menyebar ke area Gorong-gorong, Hasanudin dan Nawaripi dengan total tiga distrik di Kabupaten Mimika,"" kata Sabelina. Terkait adanya virus ASF tersebut, kini Dinas Peternakan dan Kesehatan Hewan Kabupaten Mimika telah melakukan sosialisasi kepada pemilik ternak babi. ""Kami sudah distribusi disinfektan kepada peternak babi untuk menyemprot kandang,"" kataya.Dinas Peternakan dan Kesehatan Hewan Kabupaten Mimika juga melarang para peternak untuk menjual babi yang sakit dan mati. ""Kita telah berusaha untuk memutus mata rantai dan meminta warga untuk tidak menjual babi bahkan dibawa dari luar Timika,"" tandas Sabelina.";30/01/2024;;
255;N261;bali;tribun_bali;https://bali.tribunnews.com/2024/03/27/ratusan-babi-di-karangasem-mati-mendadak-diduga-kuat-akibat-asf-tersebar-di-semua-kecamatan;"""babi"" ""mati"" ""2024""";27/09/2024;domestic;Tayang: Rabu, 27 Maret 2024 04:52 WITA;Ratusan Babi di Karangasem Mati Mendadak, Diduga Kuat Akibat ASF, Tersebar di Semua Kecamatan;"TRIBUN-BALI.COM, AMLAPURA- Peternak babi resah. Ratusan ekor babi di Desa Ban, Kecamatan Kubu,Karangasemmendadak mati, dari Februari hingga Maret 2024. Gejalanya hampir sama. Babi tidak mau makan, badan panas, dan mencret. Selain itu bengong, tak beraktivitas seperti biasanya, sempat kejang, dan muncul bintik merah. Mengingat banyak babi masyarakat mati mendadak. Satu KK di Desa Ban bisa kehilangan 25 ekor babi, induk dan anak. Seandainya diakumulasi keseluruhannya, babi warga Desa Ban yang mati mencapai 200 ekor lebih. 200 ekor lebih yang mati dalam 1 bulan, dari Februari sampai Maret 2024. 1 KK rata-rata memelihara lebih dari 3 ekor. Ada yang memelihara 20-25 ekor. Dan semuanya mati. Babi mati menyebar di semua banjar di Desa Ban. Terbanyak yakni di Banjar Cucut dan Dlundungan,"" kata Gede Tamu Sugiantara, Selasa 26 Maret 2024. Warga bersedih. Sebagian besar warga yang babinya mati adalah KK kurang mampu. Pihaknya tidak bisa berbuat apa-apa.Diperkirakan kematian ratusan babi di Desa Ban karena terserang virus African Swine Fever (ASF).""Tidak hanya di Desa Ban, daerah lain juga sama. Banyak babi mati mendadak. Gejalanya hampir sama,"" imbuh Gede Tamu. ""Kita sudah sampaikan kondisi ini ke Dinas Pertanian, Pangan, dan Perikanan Karangasem. Mereka sudah ke lokasi melakukan sosialisasi ke warga, kelian banjar dan memberi desinfektan untuk disemprotkan ke sekitar kandang. Biar virusnya mati,"" kata Tamu, sapaannya. Kejadian serupa juga terjadi di Desa/Kecamatan Abang.
";27/03/2024;;
256;N262;bali;bali_express;https://baliexpress.jawapos.com/bisnis/674506216/seratusan-babi-mati-di-karangasem-satu-sampel-positif-bikin-dinas-pertanian-dan-ketahanan-pangan-bali-lakukan-langkah-antisipasi;"""babi"" ""mati"" ""2024""";27/09/2024;domestic;- Senin, 1 April 2024 | 21:32 WIB;Seratusan Babi Mati di Karangasem: Satu Sampel Positif Bikin Dinas Pertanian dan Ketahanan Pangan Bali Lakukan Langkah Antisipasi;;01/04/2024;;
257;N263;papua tengah;ceposonline;https://www.ceposonline.com/mimika/1994998852/8000-ekor-babi-mati-di-mimika-papua-tengah-serangan-virus-african-swine-fever;"""babi"" ""mati"" ""2024""";27/09/2024;domestic;- Selasa, 20 Agustus 2024 | 21:01 WIB;8.000 Ekor Babi Mati di Mimika Papua Tengah: Serangan Virus African Swine Fever;;20/08/2024;;
258;N264;papua;fajar_papua;https://fajarpapua.com/2024/06/01/virus-asf-menyebar-di-jayapura-puluhan-ekor-ternak-babi-dimusnakan/#google_vignette;"""babi"" ""mati"" ""2024""";27/09/2024;domestic;June 1, 2024;Virus ASF Menyebar di Jayapura, Puluhan Ekor Ternak Babi Dimusnahkan;Artikel ini telah tayang diTribun-Bali.comdengan judul Ratusan Babi di Karangasem Mati Mendadak, Diduga Kuat Akibat ASF, Tersebar di Semua Kecamatan,https://bali.tribunnews.com/2024/03/27/ratusan-babi-di-karangasem-mati-mendadak-diduga-kuat-akibat-asf-tersebar-di-semua-kecamatan.;01/06/2024;;
259;N265;papua tengah;koran_papua;https://koranpapua.id/2024/03/04/kematian-babi-di-timika-tembus-3-278-ekor-warga-sp6-palang-lahan-penguburan/#google_vignette;"""babi"" ""mati"" ""2024""";27/09/2024;domestic;4 Maret 2024;Kematian Babi di Timika Tembus 3.278 Ekor, Warga SP6 Palang Lahan Penguburan;Penulis: Saiful Rohim | Editor: Putu Dewi Adi Damayanthi;04/03/2024;;
260;N266;papua tengah;seputar_papua;https://seputarpapua.com/view/update-kasus-asf-mimika-sudah-240-ekor-babi-mati.html#google_vignette;"""babi"" ""mati"" ""2024""";27/09/2024;domestic;Senin, 29 Jan 2024 13:20 WIT;Update Kasus ASF Mimika, Sudah 240 Ekor Babi Mati;seputarpapua.comAktual IndependenTIMIKA | Dinas Peternakan dan Kesehatan (Disnakkeswan) Mimika, Papua Tengah, memberikan informasi terbaru kasus Asian Swine Fever (ASF) di Mimika.Kepala Disnakkeswan Mimika Sabelina Fitriani menyebut, ASF dinyatakan masuk ke Mimika usai adanya uji lab dari Loka Veteriner Jayapura pada 23 Januari 2024 lalu yang meyebut sample yang dikirim pihaknya dinyatakan positif ASF.Sabelina melanjutkan per 29 Januari 2024 sebanyak 245 ekor babi mati sejak Mimika dinyatakan terjangkit ASF.“Lokasinya di awal itu di Jalan Baru, Gorong-gorong, Hasanuddin, ada juga di Nawaripi, jadi 3 distrik kita sudah kena,” katanya.Sabelina memaparkan, Disnakkeswan melakukan beberapa langkah untuk menanggulangi ASF di Mimika yakni dengan melakukan sosialisasi dari kandang ke kandang, dan distribusi disinfektan.“Tapi kita tidak masuk ke kandang, karena bisa menjadi sumber penularan, jadi kita meminimalisir penularan,” katanya.Sabelina mengungkapkan, selain petugas, pihaknya juga mengimbau agar peternak untuk mengisolasi babi yang sehat maupun sakit dari kandang.“Kita mencoba untuk memutus rantai penularan, kita imbau ke masyarakat untuk membatasi (kontak dengan babi),” ujarnya.Menurut data Disnakkeswan, babi yang mati akibat ASF per hari bisa mencapai 2 sampai 6 ekor.Pnyebab awal penularan ASF di Mimika diduga dari makanan sisa yang diambil peternak.“Setelah masuk di tahun baru ini kita prediksi ada tentengan berupa oleh-oleh produk babi baik berupa dendeng, asap dan sei yang dibawa masuk, jadi sisa makanan itu yang menular ke ternak babi,” paparnya.Menurut Sabelina, sisa makanan dari produk daging babi berupa sei, dendeng, atau pun asap itu belum masak sepenuhnya.“Virus itu masih dapat bertahan hidup itu pada pemanasan 65 derajat, dia masih hidup kemudian di suhu dingin dia bisa bertahan sampai 1000 hari, di kotoran ternak itu bertahan sampai 160 hari, virus mati kalau pemanasannya di atas 100 derajat,” tuturnya.Dapatkan update berita pilihan dan breaking news setiap hari dari Seputar Papua. Mari bergabung di Grup Telegram “Seputarpapua.com News”, caranya klik link https://t.me/seputarpapua , kemudian join. Anda harus install aplikasi Telegram terlebih dulu di ponsel.Anda Harus Login untuk berkomentar. Belum Punya Akun ?                  Daftar GratisCopyright @ 2017-2024 seputarpapua.com , All right reserved;29/01/2024;;
261;N267;papua tengah;suara_papua;https://suarapapua.com/2024/02/26/gawat-di-mimika-2-500-ekor-babi-mati-terserang-virus-asf/;"""babi"" ""mati"" ""2024""";27/09/2024;domestic;26 Feb 2024, 10:56 WP;Gawat! Di Mimika, 2.500 Ekor Babi Mati Terserang Virus ASF;—JAYAPURA, SUARAPAPUA.com — Dalam enam pekan terakhir, ribuan ekor babi peliharaan masyarakat di Timika, kabupaten Mimika, Papua Tengah, mati tiba-tiba. Penyebabnya, virus African Swine Fever (ASF) yang merebak di kota Dollar sejak 10 Januari 2024 lalu.drh. Sabelina Fitriani, M.Si, kepala Dinas Peternakan dan Kesehatan Hewan kabupaten Mimika, Senin (26/2/2024),.membeberkan fakta hingga hari ini sudah tercatat 2.500 ekor babi milik masyarakat di kabupaten Mimika mati terserang virus ASF.“Ini data lapangan yang kami miliki terhitung sejak virus ASF merebak di kabupaten Mimika mulai tanggal 10 Januari 2024 hingga hari ini, 26 Februari 2024,” kata Sabelina.Kian mengganasnya virus ASF diakui satu tantangan serius yang kini harus dihadapi semua pihak di kabupaten Mimika.Sebab sejauh ini belum ada obat atau vaksin ampuh, tentunya menurut Fitriani, hal yang terus dilakukan adalah memberikan edukasi kepada warga masyarakat untuk mengambil langkah-langkah preventif mencegah makin meluaskan penularan virus ASF.“Kami terus sosialisasikan agar para peternak dan masyarakat umum harus patuhi dengan beberapa upaya pencegahan supaya penularannya tidak cepat meluas,” jelasnya.Salah satu upaya pencegahan, kata Sabelina, setiap peternak babi di kabupaten Mimika wajib melakukan sterilisasi kandang babi.“Hampir setiap hari babi-babi mati akibat terpapar virus ASF, sehingga kandangnya harus disterilkan untuk mencegah penularan lebih lanjut. Vaksinnya memang belum ada. Jadi, upaya memutus mata rantai penyebaran virus ASF di kabupaten Mimika harus terus dilakukan. Dan, itu yang kami dorong kepada para peternak agar harus berperan aktif,” tuturnya.Virus ASF diketahui dapat bertahan hidup dalam jangka waktu yang lama. Oleh karenanya, kata Sabelina Fitriani, para peternak disarankan untuk melakukan sterilisasi kandang per dua hari.“Langkah pencegahannya, para peternak harus melakukan sterilisasi kandang babi dengan menggunakan disinfektan. Kandang yang terinfeksi harus dikosongkan dan disemprot dengan disinfektan untuk memastikan sudah bersih dari virus ASF. Selain itu kandangnya disikat dengan bayclin dan sabun. Itu namanya bio sekuriti kandang,” terang Fitriani.Bagi babi yang masih bertahan disarankan untuk beri serum ScoVet ASF dan vaksin kolera agar antibodinya tetap stabil.Dikemukakan, wabah ASF telah menjadi perhatian serius bagi para peternak dan otoritas terkait dengan mengambil langkah-langkah pencegahan tepat demi melindungi industri peternakan dan kesehatan hewan di kabupaten Mimika.Fitriani menambahkan, baru-baru ini telah dilakukan penguburan massal babi-babi di salah satu lokasi milik Pemkab Mimika yang letaknya jauh dari kawasan pemukiman warga Timika.Merebaknya virus ASF di kabupaten Mimika tentu saja patut diwaspadai tujuh kabupaten lainnya di provinsi Papua Tengah.Di kabupaten Nabire, misalnya. Pemerintah daerah telah mengeluarkan surat edaran dalam rangka mengantisipasi wabah tersebut masuk Nabire.Sekalipun Dinas Peternakan kabupaten Nabire menyatakan belum ada kasus ASF, para peternak diminta tetap waspada. Begitupun kepada masyarakat, diwarning untuk tidak impor babi dari Mimika ataupun daerah lain di luar Nabire.Tak Berdampak ke ManusiaMenurut drh. Daud Edowai, salah satu dokter hewan di provinsi Papua Tengah, mewabahnya virus mematikan itu tidak berbahaya bagi kesehatan manusia. Tetapi sasarannya hanya ternak babi. Dengan tingkat penularan virusnya sangat cepat.Hingga kini virus tersebut tengah melanda kabupaten Mimika, harap Daud, tentunya kabupaten tetangga, seperti Deiyai, Paniai, Dogiyai, Puncak Jaya, Puncak, Intan Jaya dan Nabire, harus siaga 1 untuk menghindari ASF masuk.“Kabupaten lain harus waspadai, jangan sampai virus ini masuk serang babi. Kalau itu sampai terjadi, salah satu ternak milik masyarakat akan rugi besar,” ujarnya.Edowai akui virus ASF sangat berbahaya bagi ternak babi, tidak kepada kesehatan manusia.Untuk mencegah berbagai kemungkinan di kemudian hari, ia berharap agar perlu ada peraturan daerah (Perda) pengawasan lalu lintas ternak babi.“Pemerintah daerah bersama pimpinan OPD terkait harus segera memfasilitasi kami untuk menyusun regulasi daerah,” kata Edowai.Selain itu, pemerintah daerah juga mesti pro aktif terhadap upaya pencegahannya dengan dukungan dana operasional.“Mohon dukung kami operasional siaga satu virus ASF,” pintanya.Daud berharap, sejak dini perlu lakukan upaya waspada terhadap ASF, karena virus tersebut telah menghancurkan sentra-sentra peternakan babi di Indonesia, seperti Toraja, Sumatera, Bali, dan daerah lainnya.Dikutip dari laman Word Organisation for Animal Health (WOAH), African Swine Fever (ASF) merupakan penyakit pada babi yang disebabkan oleh virus ASF (ASFV) dari famili Asfarviridae. Virus ini menimbulkan berbagai pendarahan organ internal pada babi domestik maupun babi hutan. Proses penularan dengan angka kematian yang sangat tinggi, namun hingga kini belum ada vaksin atau pengobatan efektif untuk mencegah penyakit ini.ASF, dalam bahasa Indonesia disebut penyakit demam babi Afrika, diketahui sebagai penyebab hilangnya populasi babi secara besar-besaran dan dampak ekonomi yang drastis dalam beberapa tahun terakhir. Virus ini menyerang beberapa wilayah di dunia. Selain menghambat kesehatan dan kesejahteraan hewan, juga berdampak buruk pada keanekaragaman hayati dan mata pencaharian para petani.WOAH atau Organisasi Kesehatan Hewan Dunia bekerja sama dengan mitra, industri, dan pakarnya mendukung negara-negara dalam upaya mencegah dan mengendalikan virus mematikan itu. [];26/02/2024;;
262;N268;papua tengah;fajar_papua;https://fajarpapua.com/2024/04/03/hingga-1-april-2024-jumlah-kematian-babi-akibat-asf-di-timika-capai-5-819-ekor/#google_vignette;"""babi"" ""mati"" ""2024""";27/09/2024;domestic;April 3, 2024;Hingga 1 April 2024, Jumlah Kematian Babi Akibat ASF di Timika Capai 5.819 Ekor;"Timika, fajarpapua.com – Dinas Peternakan dan Kesehatan Hewan Kabupaten Mimika mencatat hingga 1 April 2024, sebanyak 5.819 ekor ternak babi mati terkena African Swine Fever (ASF) .Hal ini diungkapkan Kepala Dinas Peternakan dan Kesehatan Hewan Kabupaten Mimika, dr. Sabelina Fitriani kepada wartawan, Rabu (3/4).Angka kematian ternak babi akibat ASF tersebut didapat pihaknya berdasar perhitungan angka kematian dari setiap distrik.“Perhitungan berdasar data perdistrik yang masuk ke dinas dan saat ini sudah mencapai 5.819 ekor babi yang mati akibat ASF ya,” ujarnya.Sabelina mengatakan, menurut data yang ada wilayah Kabupaten Mimika terbagi dalam empat wilayah zona penularan yakni hijau, kuning, dan merah.“Wilayah ini kita bagi menjadi beberapa zona dengan tujuan untuk melihat wilayah mana yang perlu diwaspadai. Untuk area hijau atau aman ada dua distrik yaitu iwaka kemudian Distrik Kwamki Narama,” jelasnya.Sedangkan untuk wilayah kuning atau perlu perhatian ada Distrik Kuala Kencana dan ada dua Distrik yang mendapatkan zona merah yaitu Distrik Mimika Baru dan Distrik Wania.“Jadi untuk Distrik Kuala Kencana ada sebanyak 146 ekor, dan warna merah Distrik Mimika Baru 2.787 ekor dan Distrik Wania 2.017 ekor, ini untuk data sampai tanggal 1 April kemarin,”ujarnyaDirinya berharap untuk beberapa Distrik yang masih zona kuning dan merah lebih memperhatikan ternaknya dengan lebih baik sehingga tidak ada lagi babi yang mati.” Kami berharap para pemilik ternak sadar akan kebersihan terutama beberapa wilayah yang zona merah itu, dan kuning sehingga tidak ada lagi kenaikkan angka,” tutupnya. (moa)Your email address will not be published. Required fields are marked *document.getElementById(comment).setAttribute( id, a6b98a2b6d7ef8b38f8c1b7b22283bfd );document.getElementById(j6a36f5dc2).setAttribute( id, comment );Save my name, email, and website in this browser for the next time I comment.Δdocument.getElementById( ak_js_1 ).setAttribute( value, ( new Date() ).getTime() );Jayapura, fajarpapua.com- Pemerintah Provinsi Papua mulai Rabu (5/6/2024)…Jayapura, fajarpapua.com- Penjabat Bupati Jayapura, Triwarno Purnomo menghimbau…Jayapura, fajarpapua.com – Sebanyak 35 ekor ternak babi…Timika, fajarpapua.com – Wakil Bupati Mimika Johannes Rettob…Timika, fajarpapua.com – Warga Kilometer 5, Nawaripi, Kelurahan…Timika, fajarpapua.com – Banyaknya bangkai babi yang dibuang…";03/04/2024;;
263;N269;papua tengah;fajar_papua;https://fajarpapua.com/2024/03/19/sudah-6-000-ekor-ternak-babi-di-timika-yang-mati-terserang-wabah-virus-asf/#google_vignette;"""babi"" ""mati"" ""2024""";27/09/2024;domestic;March 19, 2024;Sudah 6.000 Ekor Ternak Babi di Timika yang Mati Terserang Wabah Virus ASF;"Timika, fajarpapua.com – Hingga pertengkaran Maret 2024, Dinas Peternakan dan Kesehatan Hewan (Disnak Keswan) Kabupaten Mimika, Provinsi Papua Tengah mencatat sudah 6.000 ekor ternak babi yang mati akibat terserang virus African Swine Fever (ASF).Kepala Dinas Peternakan dan Kesehatan Hewan Kabupaten Mimika Sabelina Fitriani di Timika, Senin, mengatakan yang dilaporkan dan tercatat ada sebanyak 5.000 lebih babi mati akibat virus ASF.“Jadi, yang tercatat ada 5.000 lebih babi yang mati karena virus, ini belum terhitung dengan yang tidak melapor, jadi kami prediksikan sudah mencapai 6.000 ekor yang mati,” katanya.Menurut Sabelina, wilayah yang sebelumnya masih zona hijau, yakni SP 2 dan SP 3, hampir semua sudah masuk zona merah ASF.“Saat ini populasi ternak babi yang mati akibat ASF ini sudah mencapai 50 persen, kita masih punya sisa 50 persen populasi lagi yang harus diselamatkan,” ujarnya.Dia menjelaskan jumlah populasi ternak babi di Mimika mencapai 12.000 ekor, yang mati hingga saat ini mencapai 6.000 ekor.“Kita harus selamatkan setengah populasi yang masih ada ini, dengan memutus mata rantai penyebaran virus,” katanya.Pihaknya mengimbau bagi masyarakat yang juga sebagai peternak babi untuk tidak membuang bangkai ternak mati ke sungai atau semak-semak guna memutus mata rantai penyebaran virus ASF.“Ternak babi yang mati karena virus harus dikuburkan, untuk itu bagi masyarakat yang membutuhkan bantuan dinas untuk mengubur bangkai dapat menghubungi kami untuk dibantu, ini salah satu langkah memutus mata rantai ASF di Mimika,” ujarnya.Your email address will not be published. Required fields are marked *document.getElementById(comment).setAttribute( id, aa2bfbde5dd280008f1b378f211862ff );document.getElementById(j6a36f5dc2).setAttribute( id, comment );Save my name, email, and website in this browser for the next time I comment.Δdocument.getElementById( ak_js_1 ).setAttribute( value, ( new Date() ).getTime() );Jayapura, fajarpapua.com- Pemerintah Provinsi Papua mulai Rabu (5/6/2024)…Jayapura, fajarpapua.com- Penjabat Bupati Jayapura, Triwarno Purnomo menghimbau…Jayapura, fajarpapua.com – Sebanyak 35 ekor ternak babi…Timika, fajarpapua.com – Wakil Bupati Mimika Johannes Rettob…Timika, fajarpapua.com – Warga Kilometer 5, Nawaripi, Kelurahan…Timika, fajarpapua.com – Dinas Peternakan dan Kesehatan Hewan…";19/03/2024;;
264;N270;papua tengah;koran_papua;https://koranpapua.id/2024/02/29/kabar-terbaru-sudah-2-938-ekor-babi-di-timika-mati-terserang-virus-asf/;"""babi"" ""mati"" ""2024""";27/09/2024;domestic;29 Februari 2024;Kabar Terbaru, Sudah 2.938 Ekor Babi di Timika Mati Terserang Virus ASF;Petugas Dinas Peternakan dan Kesehatan Hewan Mimika menyemprot disinfektan terhadap babi-babi yang sudah mati sebelum dikuburkan di lahan milik Pemkab Mimika. (foto : Ist./Koranpapua.id)TIMIKA, Koranpapua- Tingkat kematian ternak babi milik masyarakat Kabupaten Mimika, Provinsi Papua Tengah akibat terserang ganasnya virus African Swine Fever (ASF) terus meningkat.Berdasarkan update terbaru, jumlah kematian ternak babi terhitung sejak tanggal 16-27 Februari 2024 sudah mencapai  2.938 ekor. Data tersebut dikeluarkan Dinas Peternakan dan Kesehatan Hewan (Disnak-Keswan) yang diterima Koranpapua.id, Kamis 29 Februari 2024.Ribuan ekor babi yang mati ini tersebar di lima distrik, yakni Distrik Kwamki Narama terdapat tujuh ekor, Distrik Kuala Kencana 47 ekor, Distrik Iwaka sembilan ekor, Distrik Mimika Baru 1.445 ekor, Distrik Wania 943 ekor dan tanpa alamat atau nama tercatat 487 ekor.Babi yang mati dikuburkan di lahan milik Pemerintah Kabupaten Mimika yang letaknya jauh dari pemukiman warga. Sedangkan yang tidak dilaporkan ke Disnak-Keswan dikuburkan sendiri oleh pemiliknya.Sebelumnya, Kepala Bidang Kesehatan Hewan, Bakti Erma Surfani menjelaskan, penyakit ASF hampir sama dengan Covid-19. Apabila satu ekor sudah tertular, maka secara otomatis akan menyebar ke semua babi yang ada di kandang.Sementara drh. Sabelina Fitriani, M.Si, Kadisnak-Keswan mengatakan, virus ASF mampu bertahan hidup dalam suhu panas 65 derajat atau kondisi dingin sekalipun.Sabelina menuturkan, sampai saat ini pihaknya belum memiliki vaksin. Karenanya kepada peternak, ia menyarankan untuk tetap menjaga bio sekuriti kandang.Dengan cara selalu membersihkan lantai kandang yang disikat menggunakan bayclean, sabun dan disemprot dengan disinfektan.Peternak juga diminta untuk menjaga lalulintas ternak babi, jangan keluar masuk secara bebas atau memindahkan babi ke kandang yang lain.Kemudian kepada masyarakat Toraja, Batak, Flobamora untuk sementara waktu dilarang memotong hewan babi dalam setiap acara kekeluargaan.Tips lain untuk mencegah meluasnya virus ASF ini yakni, daging babi yang tidak habis dimakan jangan dibuang, tetapi harus dikubur.Ini bertujuan agar sisa makanan tidak dihinggap lalat atau dimakan tikus dan burung. Karena lalat, tikus dan burung merupakan media penyebaran ASF.Sedangkan kepada peternak yang hendak melanjutkan usahanya, Sabelina menganjurkan agar membuat kandang di lokasi baru yang jauh dari pemukiman. (Redaksi)Cek juga berita-berita Koranpapua.id di Google News© 2024 Koranpapua.id© 2024 Koranpapua.id;29/02/2024;;
265;N271;papua tengah;antara_papuabarat;https://papuabarat.antaranews.com/berita/40197/1726-ternak-babi-di-mimika-mati-akibat-virus-asf;"""babi"" ""mati"" ""2024""";27/09/2024;domestic;Sabtu, 24 Februari 2024 6:23 WIB;1.726 ternak babi di Mimika mati akibat virus ASF;Timika (ANTARA) - Dinas Peternakan dan Kesehatan Hewan (DPKH) Kabupaten Mimika, Provinsi Papua Tengah menyebutkan bahwa hingga saat ini jumlah ternak babi yang mati akibat virus african swine fever (ASF) mencapai 1.726 ekor.Kepala Bidang Kesehatan Hewan Bakti Erma Surfani di Timika, Rabu, mengatakan bahwa setiap hari ada lebih dari 100 ternak babi yang mati karena terpapar virus ASF tersebut.Sampai dengan 20 Februari 2024 ada sebanyak 1.726 ternak babi yang mati karena virus ASF, jadi kami imbau agar peternak dapat mensterilkan kandang guna mencegah penyebaran ke kandang lainnya, katanya.Menurut Bakti, saat ini pihaknya masih melakukan pengkajian lanjutan guna memutus mata rantai penyebaran virus ASF di Kabupaten Mimika.Kami telah mengundang para peternak babi untuk bersama kita membahas langkah memutus mata rantai ASF, karena pihak yang sangat terdampak yakni para peternak yang juga pedagang, ujarnya.Dia menjelaskan virus ASF ini dapat bertahan hidup dengan waktu yang cukup lama, sehingga pihaknya menyarankan agar peternak mensterilkan kandang selama enam bulan.Virus ini mampu hidup dalam jangka waktu yang lama, jadi kami imbau peternak mensterilkan kandang dengan menyemprotkan disinfektan serta mengosongkan kandang selama enam bulan, katanya.Dia menambahkan Dinas Peternakan dan Kesehatan Hewan menyediakan vaksin bagi ternak yang masih sehat, dan jika satu kandang telah terjangkit harus dikosongkan dalam jangka waktu lama.Memang untuk kandang yang telah terinfeksi harus dikosongkan dengan waktu yang lama dan disemprot disinfektan untuk mensterilkan kandang, ini merupakan salah satu langkah memutus mata rantai ASF, ujarnya.Berita ini telah tayang di Antaranews.com dengan judul: Di Mimika 1.726 ternak babi mati akibat virus ASF;24/02/2024;;
