no;doc_id;province;source_web;url;key_word;date_access;species;news_publish;news_title;news_content;clean_date;;
1;N001;sumatera utara;bbc_news;https://www.bbc.com/indonesia/indonesia-50342554;"babi ""mati"" ""sumatera utara"" ""2019""";09/10/2024;domestic;09-Nov-19;Kolera dan demam babi Afrika sebabkan ribuan babi mati di Sumut: Bahayakah untuk kesehatan manusia?;Sumber gambar, Getty ImagesRibuan babi mati di Sumatera Utara, diduga akibat virus kolera babi dan demam babi Afrika (African Swine Fever atau ASF). Apakah virus ini berbahaya bagi manusia?Riahta Tarigan, seorang perempuan berusia 66 tahun, duduk termenung lesu, menanti pelanggan untuk singgah ke lapak daging babi miliknya di pinggir Jalan Jamin Ginting Medan, Sumatera Utara.Daging babi yang digantungnya, maupun yang telah dipotong-potongnya, tak jua disentuh oleh para pembeli.Sumber gambar, Getty ImagesIbu dari dua anak ini mengatakan sepinya penjualan daging babi akhir-akhir ini adalah dampak dari pemberitaan matinya ribuan ternak babi di berbagai daerah di Sumatera Utara.Sudah takut orang makan daging babi setelah mengetahui berita itu, jualan kami jadi sepi, kata Riahta.Riahta menerangkan biasanya dalam satu hari, ia bisa menjual dua ekor babi, yang beratnya kira-kira 200 kilogram. Namun sekarang, Riahta mengaku, untuk menghabiskan 50 kg daging babi dalam sehari saja sangat sulit.Paling banyak, ujarnya, ia hanya menjual sekitar 20 kg daging babi sehari, itu pun dengan harga yang lebih murah daripada biasanya.Seorang pengusaha lapo di Medan, Dahniar Saragih, 75, juga mengaku kasus kematian ribuan babi, yang diikuti dengan pembuangan bangkainya ke sungai, memukul para pengusaha.Sumber gambar, Getty ImagesDahniar mengaku selama ini keuntungan yang bisa diperolehnya bisa mencapai Rp 6 juta per hari, namun kini pendapatannya menurun drastis.Sekarang dapat Rp 200.000 per hari saja sudah syukur, itu pun sulit, katanya.Desman Hutagaol, 38, salah seorang warga Medan penggemar daging babi, mengaku takut mengkonsumsi daging babi karena khawatir tertular penyakit.Tentu takut, tapi saya tetap makan daging babi sedikit saja, tidak seperti rutin biasa, kata Desman.Hingga awal pekan ini, jumlah babi yang mati mencapai 4.682 ekor di 11 kabupaten/kota di Sumatera Utara, yakni di Dairi, Humbang Hasundutan, Deli Serdang, Medan, Karo, Toba Samosir, Serdang Bedagai, Tapanuli Utara, Tapanuli Tengah, Tapanuli Selatan, dan Samosir.Sumber gambar, ISTIMEWARatusan bangkai babi pun mengambang di sepanjang aliran sungai Bederah, Kecamatan Medan Marelan. Di Kabupaten Dairi, bangkai babi juga mencemari aliran sungai desa Karing, Kecamatan Berampu.Warga mengeluhkan bau busuk yang bersumber dari bangkai babi tersebut. Padahal aliran sungai itu biasanya digunakan warga untuk mencuci, mandi bahkan minum air.Direktur Kesehatan Hewan, Ditjen Peternakan dan Kesehatan Hewan, Kementerian Pertanian Fajar Sumping, mengatakan hasil uji laboratorium menunjukkan matinya babi-babi itu disebabkan virus kolera babi dan demam babi afrika (ASF).Sumber gambar, Getty ImagesBaik kolera babi dan ASF tidak menular ke manusia (tidak zoonisis), jadi tidak membahayakan kesehatan manusia, ujar Fajar kepada wartawan BBC News Indonesia Callistasia Wijaya.Virus ini juga tidak menyebar ke hewan lainnya, tapi hanya menyebar dari satu babi ke babi lainnya.Fajar mengatakan konsumsi daging babi tidak bahaya karena virus mati bila dimasak atau dipanaskan, tapi dia tidak menganjurkannya karena penyembelihan bisa membuat babi-babi lainnya di sekitar peternakan ikut tertular penyakit ini.Tidak dianjurkan karena pada saat penyembelihan dapat menyebarkan virus bila darah dan sisa-sisa kulit bulu, jeroan, dan sebagainya, tidak ditangani (dikubur) dengan benar, ujarnya.Hal serupa dikatakan oleh Dokter Hewan Cecep Moch Wahyudin, anggota Persatuan Dokter Hewan Indonesia (PDHI) Bogor.Masyarakat tidak perlu khawatir dengan hog cholera ini, tetapi tetap dengan melihat (aspek) keetisan, babi yang tertular sebaiknya tidak dikonsumsi, ujarnya.Organisasi Kesehatan Hewan Dunia (OIE) memaparkan bahwa ASF disebabkan virus dari famili Asfaviridae, sementara kolera babi disebabkan virus dari famili Flaviviridae.Saat ini, vaksin untuk kolera babi sudah tersedia, namun tidak untuk ASF.Untuk ASF yang menjadi perhatian adalah kerugian ekonomi karena penyebarannya luas dan cepat serta menyebabkan kematian yang tinggi.  Hal tersebut karena tidak ada vaksin dan obatnya, ujar Direktur Kesehatan Hewan Kementerian Pertanian Fajar Sumping.Dokter Hewan Cecep  Wahyudin mengatakan kedua penyakit ini dapat timbul karena kondisi peternakan.Sumber gambar, Getty ImagesLebih diakibatkan pola pemeliharaan yang jorok dan tidak terpola sehingga biasanya banyak sekali menyerang peternakan babi yang konvensional, ujarnya.Intinya menyerang peternakan yang jorok dan tidak menerapkan manajemen bio security yang benar, seperti peternakan yang lembab, becek, dan basah, ujarnya.Kepala Dinas Ketahanan Pangan dan Peternakan Sumut, Azhar Harahap, sebelumnya mengatakan, kasus kematian babi terjadi di peternakan masyarakat, bukan peternakan yang dikelola perusahaan.Sementara itu, menurut Direktur Kesehatan Hewan Kementerian Pertanian Fajar Sumping, kedua penyakit itu dapat menyebar oleh babi yang terinfeksi atau dari daging babi segar dan olahan dari babi yg terinfeksi.Ada sisa makanan dari kapal dan pesawat yang dimanfaatkan untuk pakan babi, ujar Fajar.Fajar mengatakan saat ini penanganan di lapangan sudah dilakukan sesuai pedoman, yakni mengubur babi yang mati dan melakukan pembersihan kandang-kandang ternak dengan desinfektan.Pemerintah Provinsi Sumatera Utara juga sudah menerapkan pelarangan peredaran babi dari daerah yang terjangkit virus ke daerah yang belum terjangkit.Lebih lanjut, Dokter Hewan Cecep Moch Wahyudin, anggota Persatuan Dokter Hewan Indonesia (PDHI) Bogor, mengatakan untuk babi yg terlanjur tertular dan mati, perlakuannya sama dengan penanganan bangkai hewan tertular penyakit berbahaya pada umumnya.Yang paling tepat adalah dibakar, tetapi jika jumlahnya besar maka sebaiknya dilakukan penguburan dengan cara yang tepat. Biasanya penguburan dilakukan dengan kedalaman yang cukup sehingga tidak mudah digali binatang pemakan bangkai selesai selesai dikubur, ujarnya.Sumber gambar, Getty ImagesSelain itu, untuk menonaktifkan virus, bangkai hewan maupun kuburan hewan bisa ditaburi dengan kapur agar kondisi tanah menjadi basa.Cecep menambahkan, praktik pembuangan bangkai babi ke sungai harus dihentikan karena dapat membuat penyebaran virus lebih cepat.Sementara itu, Pemerintah Provinsi Sumatera Utara mewacanakan pengesahan Peraturan Gubernur yang melarang warga membuang bangkai babi dan binatang lainnya ke sungai.Kita akan terbitkan Pergub berisi aturan main, termasuk pemberian sanksi kepada pelaku pembuangan bangkai binatang atau sampah ke sungai, kata Edy Rahmayadi.Menurut data BPS terbaru, Sumatera Utara adalah provinsi penghasil daging babi terbesar kedua di Indonesia setelah Bali. Tiap tahunnya, Sumatera Utara memproduksi lebih dari 40,000 ton daging babi.© 2025 BBC. BBC tidak bertanggung jawab atas konten dari situs eksternal. Baca tentang peraturan baru terkait link eksternal.;09/11/2019;;
2;N002;sumatera utara;voa_indonesia;https://www.voaindonesia.com/a/demam-babi-afrika-mewabah-di-sumut-30-000-babi-mati/5213961.html;"babi ""mati"" ""sumatera utara"" ""2019""";09/10/2024;domestic;21/12/2019;Demam Babi Afrika Mewabah di Sumut, 30.000 Babi Mati;PrintPemerintah telah mendeklarasikan demam babi Afrika sudah masuk ke Indonesia. Wilayah pertama yang diserang wabah tersebut adalah Sumatera Utara. Bahkan 30.000 babi telah mati sejak medio September 2019.Kementerian Pertanian (Kementan) telah resmi melaporkan wabah demam babi Afrika atau African Swine Fever (ASF) sudah masuk ke Indonesia khususnya di Provinsi Sumatera Utara (Sumut). Deklarasi itu tertulis dalam Keputusan Menteri Pertanian Republik Indonesia Nomor 820/KPTS/PK.320/M/12/2019 tentang pernyataan wabah demam babi Afrika pada beberapa kabupaten/kota di Sumut.Kepala Balai Veteriner Medan, Agustia mengatakan puluhan ribu babi yang mati tersebut paling dominan disebabkan oleh ASF. Demam babi Afrika membuat lebih dari 30.000 ekor babi mati sejak September 2019 di 16 kabupaten/kota di antaranya Dairi, Humbang Hasundutan, Deli Serdang, Karo, Toba Samosir, Tapanuli Utara, Tapanuli Tengah, Tapanuli Selatan, Samosir, Simalungun, Pakpak Bharat, Langkat, Tebing Tinggi, Pematang Siantar, Serdang Bedagai dan Medan.Ada dua pemainnya (penyebab) hog cholera (kolera babi) dan ASF tapi bukan dalam satu individu itu ada dua-duanya. Artinya dari sekian banyak ada yang ditemukan ASF dan Hog Cholera. Tapi yang dominan itu ASF, kata Agustia kepada VOA, Jumat (20/12).Agustia menjelaskan penyebaran virus demam babi Afrika di 16 kabupaten/kota di Sumut disebabkan dari lalu lintas pengiriman ternak babi yang telah terserang ASF kemudian dibawa dari satu tempat ke wilayah lain. Hal tersebut membuat penyebaran virus ASF begitu cepat.Kalau virus sudah ada di lapangan itu akan menyebar cepat di dalam populasi. Sementara populasi terbesar ada di Kabupaten Dairi sehingga itu yang sangat mengancam dan sampai sekarang banyak terjadi kematian di sana. Demikian juga yang di Kabupaten Deli Serdang populasi banyak, jelasnya.Agus juga mengungkapkan sampai saat ini belum ditemukan vaksin untuk mengatasi virus demam babi Afrika. Salah satu cara agar virus ASF tidak menyebar ke wilayah lain dan menjangkiti babi di Sumut, harus dilakukan pengawasan terhadap lalu lintas pengiriman ternak babi. Upaya pencegahan virus ini juga dilakukan dengan biosekuriti yaitu mencegah lalu lintas babi, melarang pemindahan ternak antar daerah, dan penyemprotan disinfektan.Kami pemerintah sudah melakukan langkah-langkah untuk mendiagnosis ini. Pemerintah juga sudah membuat langkah teknis untuk pengendalian ini (lalu lintas pengiriman ternak). Ini tidak ada obatnya jadi langkah teknisnya adalah bagaimana mengendalikan membatasi lalu lintas ternak antar daerah. Kemudian melakukan biosekuriti, dan penggunaan sisa pakan yang dibatasi, ungkapnya.No media source currently availableSebelumnya, Gubernur Sumut, Edy Rahmayadi mengaku belum menerima salinan soal surat keputusan Menteri Pertanian tentang pernyataan wabah demam babi Afrika pada beberapa kabupaten/kota di Sumut.Saya belum (menerima). Tapi saya sudah dengar, itu perlu keabsahaan, kata Edy, Jumat (20/12).Edy saat ini masih mempelajari penetapan wabah ASF di Sumut. Namun, mantan ketua PSSI ini menyebut konsekuensi atas surat keputusan tentang wabah demam babi Afrika pada beberapa daerah di Sumut adalah dengan memusnahkan seluruh babi. Menurutnya, apabila babi-babi yang ada di Sumut akan dimusnahkan, rakyat yang memelihara hewan ternak tersebut tidak boleh dirugikan. Ganti rugi harus diberikan terhadap masyarakat apabila babi-babi milik mereka dimusnahkan. Tercatat ada 1.229.000 ekor babi di Sumut.Rakyat ini juga harus tahu, jangan dengan demikian nanti menjadikan hal-hal yang tidak baik, terus dimasukkan babi-babi dari mana-mana, hanya sekadar untuk mengambil ganti rugi ini. Tapi saya yakin rakyat kita tidak demikian, ini adalah musibah untuk kita, ungkapnya.Sementara itu, Ketua Asosiasi Pengusaha Rumah Makan Babi Panggang Karo Kota Medan, Darna Tarigan mengatakan virus ASF yang mewabah di Sumut juga mempengaruhi ekonomi para pelaku usaha daging babi. Kata Darna, banyak pengusaha rumah makan babi yang mengeluh lantaran penurunan omzet akibat wabah ASF.Itu sudah pasti mempengaruhi penurunan omzet sampai 70 persen. Pasarnya sepi jadi menumpuk di peternakan babi itu. Jadi mengonsumsi daging babi ini masih diragukan oleh pelanggan gara-gara isu ada yang mengatakan bahaya. Ada juga yang bilang tidak bahaya, sudah diperiksa di laboratorium itu daging (babi) tidak masalah, ujarnya saat dihubungi VOA.Kementerian Pertanian dalam pernyataan resmi yang diunggah di laman resminya mengatakan ASF adalah penyakit pada babi yang sangat menular dan dapat menyebabkan kematian pada hewan ternak tersebut hingga 100 persen sehingga bisa mengakibatkan kerugian ekonomi yang sangat besar. Virus ASF sangat tahan hidup di lingkungan serta relatif lebih tahan terhadap disinfektan. ASF tidak berbahaya bagi manusia dan bukan masalah kesehatan masyarakat. ASF bukan penyakit yang dapat menular dari hewan ke manusia (zoonosis), jadi produk babi dipastikan tetap aman untuk konsumsi.Untuk babi yang terkena penyakit ASF, isolasi hewan sakit dan peralatan serta dilakukan pengosongan kandang selama dua bulan. Terhadap babi yang mati karena penyakit ASF dimasukkan ke dalam kantong dan harus segera dikubur untuk mencegah penularan yang lebih luas. Penyakit ini merupakan ancaman bagi populasi babi di Indonesia yang mencapai kurang lebih 8,5 juta ekor. [aa/lt];21/12/2019;;
3;N003;sumatera utara;cnbc_indonesia;https://www.cnbcindonesia.com/news/20191108141410-4-113768/mirip-china-flu-babi-indikasi-serang-ribuan-babi-di-sumut;"babi ""mati"" ""sumatera utara"" ""2019""";09/10/2024;domestic;08/11/2019 14:39;Mirip China, Flu Babi Indikasi Serang Ribuan Babi di Sumut;Jakarta, CNBC Indonesia - Menteri Pertanian (Mentan) Syahrul Yasin Limpo mengatakan pihaknya memperketat isolasi menyusul kematian ribuan babi di Sumatera Utara (Sumut) diduga akibat virus flu babi Afrika (African swine fever/ASF). Flu babi telah membuat China pusing belakangan ini.Ia mengatakan sudah mengirim surat kepada Gubernur dan Bupati terkait untuk melaksanakan isolasi untuk mencegah meluasnya penyakit. Ia megatakan sementara ini telah dibentuk desk di tingkat nasional, provinsi, kabupaten sampai ke tingkat peternakan.Pilihan RedaksiTerima Kasih Babi, AS-China Makin MesraBukan Perang Dagang, Fokus China Buat Babi Sebesar BeruangDasar Babi Bikin Pening, Inflasi China Jadi TinggiHari ini saya menyurat kepada Gubernur dan Bupati terkait agar benar diisolasi. Balai Karantina akan ketat melakukan itu, kata Syahrul di Jakarta, Jumat (8/11)Selain itu, ia mengatakan Kementeriannya juga tengah melakukan pengendalian. Menurutnya, dari kajian akademis yang diterimanya, penyakit ini tidak menular kepada manusia.Banyak berita hoax bahwa itu menjadi cacar babi yang akan menjangkit ke manusia. Dari pendekatan akademis ternyata itu tidak menular kepada manusia tapi ini memang tidak dapat dibiarkan, katanya.Dikutip dari detikcom, Kamis (7/11/2019), Dari data Pemprov Sumatera Utara, total sementara 4.682 ekor babi mati diduga karena flu babi. Dari hasil uji laboratorium sampel bangkai babi yang dilakukan Balai Veteriner Medan, kematian ribuan babi tersebut diduga tidak hanya karena virus kolera babi. Ada temuan dugaan virus flu babi Afrika (African swine fever).Gubernur Sumatera Utara Edy Rahmayadi meminta warga tak membuang bangkai babi ke sungai. Penanganan virus kolera babi dilakukan sambil menunggu bantuan vaksin dan tenaga ahli dari pemerintah pusat.Ternak babi di tujuh kabupaten kota di Sumatera Utara (Sumut) terindikasi African Swine Fever (ASF) atau flu babi. Kepala Balai Veteriner Medan Agustia kepada awak media, hasil uji lab, selain menemukan positif Hog Cholera atau kolera babi, juga ditemukan indikasi adanya ASF atau Flu BabiPenyakit ini sudah menyerang Asia Timur sampai Asia Selatan. Indonesia belum terpapar penyakit ASF. Namun hasil uji kami ada indikasi (flu babi). Penyakit ini bereaksi terhadap uji yang kami lakukan, terang Agustia saat ditemui wartawan di kantornya, Kamis (7/11/2019).[Gambas:Video CNBC]                                         (hoi/hoi)                                                                                Next ArticleVirus Misterius Diduga Picu Kematian Seribuan Babi di Bali;08/11/2019;;
4;N004;sumatera utara;kompas_id;https://www.kompas.id/baca/utama/2019/11/07/kolera-mewabah-lebih-dari-4-600-babi-mati-di-sumut/;"babi ""mati"" ""sumatera utara"" ""2019""";09/10/2024;domestic;07/11/2019 05:01;Kolera Mewabah, Lebih dari 4.600 Babi Mati di Sumut;MEDAN, KOMPAS – Penyakit kolera babi mewabah di sejumlah sentra ternak di Sumatera Utara. Dalam sebulan ini, diperkirakan lebih dari 4.600 ekor babi mati akibat kolera. Peternak diminta mengubur bangkai ternak dan tidak membuangnya di sungai. Lebih dari 100 bangkai babi yang ditemukan di Sungai Bedera, Kota Medan, mengganggu kesehatan lingkungan.“Kami telah melakukan uji laboratorium dan menyimpulkan bahwa kematian ribuan ternak babi di Sumut diakibatkan penyakit kolera babi atau hog cholera. Kami pastikan kematian babi tidak disebabkan demam babi Afrika (african swine fever/ASF),” kata Kepala Dinas Ketahanan Pangan dan Peternakan Sumut M Azhar Harahap, di Medan, Rabu (6/11/2019).Penyakit kolera babi yang disebabkan virus demam babi klasik itu, kata Azhar, awalnya mewabah di Kabupaten Dairi dan Pakpak Bharat. Wabah tersebut lalu menyebar ke kabupaten lain seperti Deli Serdang, Simalungun, Karo, Tapanuli Utara, Humbang Hasundutan, Toba Samosir, dan Samosir.Azhar mengatakan, penyakit kolera menyerang peternakan rakyat yang umumnya tidak menerapkan program vaksin dan biosecurity (keamanan biologi). Sementara, peternakan skala menengah atau perusahaan telah menerapkan program vaksin hog cholera dengan baik sehingga tidak terserang meskipun berdekatan dengan peternak lainnya.“Hal ini juga semakin menguatkan bahwa wabah ini memang  penyakit kolera babi karena ternak yang diberi vaksin jenis tersebut ternyata bisa kebal,” katanya.Azhar mengatakan, virus demam babi klasik yang merupakan penyebab kolera babi tidak bisa menjangkit ke manusia.Pantauan Kompas, penyakit kolera babi antara lain menyebar di ratusan peternakan rakyat di Desa Helvetia, Kecamatan Sunggal, Deli Serdang. “Dalam seminggu ini, sudah 20 ekor ternak babi saya mati. Saya merugi Rp 50 juta,” kata Marni Sitohang (45), peternak babi.Marni mengatakan, awalnya ternaknya tidak mau makan. Setelah itu, darah keluar dari hidung dan dubur ternak. Dalam lima hari setelah gejala awal, ternaknya pun mati. Harga ternak babi pun anjlok dari Rp 28.000 menjadi Rp 10.000 per kilogram. Itu pun banyak yang tidak laku.Peternak lalu membuang bangkai babi ke Sungai Bedera. Ratusan bangkai tampak menumpuk dan menimbulkan bau busuk. Peternak tidak mengubur ternak karena jumlahnya yang banyak.Marni mengatakan, para peternak di desa itu tidak memvaksin ternaknya. Mereka umumnya memberi makan ternak dengan ampas tahu, ampas ubi, serta limbah makanan dari restoran dan hotel di Medan.Manajer Wilayah Senior PT Cargill Indonesia Deden Raldos Togatorop, perusahaan bidang pakan ternak, mengatakan, penyakit kolera babi menyebar begitu cepat di Sumut karena peternakan rakyat rata-rata belum menerapkan program vaksin dan biosecurity yang ketat. “Padahal, sebagian besar peternakan babi di Sumut merupakan ternak rakyat,” katanya.Deden mengatakan, peternakan rakyat di Sumut sangat penting untuk mendapat edukasi tentang program vaksin. Saat ini, populasi ternak babi di Sumut mencapai 1,2 juta ekor, tertinggi kedua di Indonesia setelah Nusa Tenggara Timur.Vaksin hog cholera seharusnya diberikan saat lepas sapih di umur satu bulan dan dilakukan pengulangan setiap dua bulan. Harga vaksin ini pun tergolong murah yakni Rp 4.500 untuk sekali vaksin per ekor.“Peternakan yang sudah menerapkan program vaksin ini tidak ada yang terserang penyakit kolera babi. Ini juga semakin menguatkan bahwa wabah ini memang bukan ASF,” kata Deden.Adapun penyakit ASF sebelumnya dilaporkan telah menyebar di China, Pulau Timor, Laos, Filipina, dan Vietnam. Sejumlah kajian memprediksi pada akhir 2019, China bisa kehilangan 350 juta dari 700 juta ekor babi di negara itu. Hingga kini, belum ada vaksin dan pengobatan terhadap ASF.;07/11/2019;;
5;N005;sumatera utara;antara_sumbar;https://sumbar.antaranews.com/berita/311600/22985-ekor-babi-mati-di-sumut-akibat-virus-kolera-babi;"babi ""mati"" ""sumatera utara"" ""2019""";09/10/2024;domestic;Sabtu, 7 Desember 2019 18:02 WIB;22.985 ekor babi mati di Sumut akibat virus kolera babi;Medan (ANTARA) - Dinas Ketahanan Pangan dan Peternakan (DKPP) Sumatera Utara mencatat hingga Sabtu sebanyak 22.985 ekor babi mati di Sumut akibat virus hog cholera atau kolera babi. Sampai saat ini, kematian babi positif karena hog cholera. ASF masih menunggu dari Menteri Pertanian, kata Kepala Bidang Kesehatan Hewan DKPP Sumut Mulkan Harahap, di Medan, Sabtu.Angka 22.985 babi yang mati tersebut menyebar di 16 kabupaten, yakni di Dairi, Humbang Hasundutan, Deli Serdang, Medan, Karo, Toba Samosir, Serdang Bedagai, Tapanuli Utara, Tapanuli Tengah, Tapanuli Selatan, Samosir, Simalungun, Pakpak Bharat, Tebing Tinggi, Siantar, dan Langkat.Menurut dia, dari 16 Kabupaten yang terdapat kematian babi, Deli Serdang merupakan yang tertinggi dengan angka 6.997 ekor, sedangkan yang tercatat kematian paling sedikit di Pematang Siantar sebanyak 12 ekor.Padahal sebenarnya kematian babi akibat hog cholera pertama kali diketahui terjadi di Dairi pada tanggal 25 September, ujarnya.Mengantisipasi meningkatnya jumlah angka kematian babi, pihaknya terus melakukan sosialisasi kepada masyarakat agar menyemprotkan disinfektan, membuka posko, penguburan bangkai babi, dan mencegah masyarakat membuang bangkai babi secara sembarangan.Kami masih terus melakukan sosialisasi, penguburan tetap terhadap bangkai babi, katanya.;07/12/2019;;
6;N006;sumatera utara;kompas_id;https://www.kompas.id/baca/utama/2019/12/07/kematian-ternak-akibat-demam-babi-afrika-masih-terjadi-di-sumut;"babi ""mati"" ""sumatera utara"" ""2019""";09/10/2024;domestic;07/12/2019 19:50;Kematian Ternak akibat Demam Babi Afrika Masih Terjadi di Sumut;MEDAN, KOMPAS — Demam babi Afrika yang masuk ke Indonesia beberapa bulan ini terus mewabah di 16 kabupaten di Sumatera Utara. Kematian ternak babi sudah lebih dari 23.000 ekor dan hingga kini masih terus berlanjut. Hingga kini, belum ada upaya penanggulangan dan pemberantasan penyakit hewan itu. Pengumuman kejadian wabah penyakit pun belum dilakukan pemerintah.Serangan wabah yang diduga demam babi afrika (african swine fever/ASF) antara lain terjadi di sentra peternakan babi di Desa Helvetia, Kecamatan Sunggal, Kabupaten Deli Serdang, Sumut. Kematian ternak babi hampir terjadi di seluruh peternakan di wilayah itu yang berjumlah sekitar 700 peternakan rakyat.”Peternakan babi adalah penopang ekonomi keluarga di desa ini. Kami sangat terpuruk dengan wabah penyakit ini,” kata Andri Siahaan (33), peternak babi di Desa Helvetia.Menurut Andri, kematian ternak babi yang sangat besar seperti sekarang ini belum pernah menyerang sentra peternakan itu. Para peternak pun tidak tahu harus berbuat apa karena tidak mengenali jenis penyakit itu.Awalnya, pemerintah menyebut ternak babi di Sumut mati karena penyakit hog cholera. Namun, hasil pemeriksaan laboratorium menunjukkan, kematian ternak terindikasi karena virus ASF. Penyakit ASF sampai sekarang belum ada vaksinasi ataupun pengobatannya.Andri mengatakan, para peternak belum mendapat sosialisasi apa pun tentang penyakit ternak itu. Ternak babi pun masih tampak dibawa keluar dari peternakan itu. Tidak ada pembatasan lalu lintas hewan sama sekali. Menurut peternak, hingga kini belum ada tindakan apa pun yang dilakukan pemerintah terhadap mereka.Andri mengatakan, peternak yang umumnya memelihara 50 babi per rumah tangga mengalami kerugian sangat besar. Mereka seharusnya menjual ternak itu pada Natal dan Tahun Baru. Dengan harga Rp 30.000 per kilogram, harga babi sekitar Rp 2,5 juta per ekor.”Sekarang sebagian besar babi mati. Harga babi pun saat ini hanya Rp 10.000 per kilogram. Itu pun tidak laku,” ujarnya.Ketua Pengurus Besar Perhimpunan Dokter Hewan Indonesia Muhammad Munawaroh mengatakan, Menteri Pertanian seharusnya mengumumkan wabah ASF agar penanganan yang dilakukan bisa maksimal sebagaimana diatur dalam Undang-Undang Nomor 18 Tahun 2009 tentang Peternakan dan Kesehatan Hewan.”Tujuan utama deklarasi wabah penyakit ASF adalah mencegah penularan penyakit semakin luas,” katanya.Munawaroh mengingatkan, pemerintah pernah terlambat mendeklarasikan penyakit flu burung (avian influenza) yang mewabah di Indonesia pada tahun 2003. ”Akibatnya, penyakit flu burung sudah telanjur menyerang semua wilayah Indonesia. Padahal, penyebaran penyakit itu seharusnya bisa ditutup di daerah tertentu saja,” ujarnya.Menurut Munawaroh, jika ditakutkan akan menghentikan ekspor, deklarasi wabah ASF bisa dilakukan hanya untuk zona Sumatera Utara. Dengan demikian, ternak babi dari wilayah masih bisa diekspor. ”Lalu lintas ternak babi dari Sumut akan ditutup sehingga ASF tidak menyebar ke daerah lain,” ujarnya.Munawaroh mengatakan, pengumuman kejadian wabah penyakit hewan akan diikuti dengan penutupan daerah tertular, pemberantasan penyakit, pengobatan hewan, pemusnahan hewan tertular, dan pengalokasian dana yang memadai. Pemerintah juga berkewajiban memberikan kompensasi terhadap ternak yang dimusnahkan.Kepala Dinas Ketahanan Pangan dan Peternakan Sumut Azhar Harahap mengatakan, pengumuman wabah penyakit merupakan wewenang Menteri Pertanian dengan melihat sejumlah kriteria, seperti peningkatan jumlah kematian, penyebaran penyakit, dan hasil pemeriksaan laboratorium.”Saat ini kasus ASF tidak menyebar lagi dari 16 kabupaten. Jumlah ternak yang mati sekitar 1,9 persen dari populasi 1,2 juta ekor,” kata Azhar.Azhar mengatakan, pemerintah telah meminta peternak membatasi pengiriman ternak babi antardaerah. Dinas juga membagikan disinfektan kepada peternak untuk meningkatkan biosecurity.;07/12/2019;;
