no;doc_id;province;source_web;url;key_word;date_access;species;news_publish;news_title;news_content;clean_date;;
120;N125;sumatera barat;suara_sumbar;https://sumbar.suara.com/read/2021/12/05/160613/belasan-ekor-babi-hutan-di-agam-mati-mendadak?page=all;"babi hutan ""mati"" ""2021""";15/10/2024;wild;Minggu, 05 Desember 2021 | 16:06 WIB;Belasan Ekor Babi Hutan di Agam Mati Mendadak;SuaraSumbar.id - Belasan ekor babi hutan di Kabupaten Agam, Sumatera Barat (Sumbar), dilaporkan mati mendadak. Peristiwa itu terjadi di sekitar Maua Hilia, Jorong Kayu Pasak Timur, Nagari Salareh Aia, Kecamatan Palembayan.Salah seorang warga Maua Ilia, Imam (34) mengatakan, puluhan babi hutan itu ditemukan warga dalam kondisi mati di perkebunan sekitar selama satu bupan terakhir.Sebelumnya ada yang melihat bangkai babi saat pergi ke kebun, kemudian warga yang lain juga mengatakan juga melihat hal yang sama. Jika dihitung sekitar 15 ekor ujarnya, dikutip dari Covesia.com - jaringan Suara.com, Minggu (5/12/2021).Menurutnya, kematian babi hutan ini tergolong janggal, sebab tidak ada ditemukan luka-luka ataupun bekas olah raga buru babi maupun serangan hewan lainnya.Baca Juga:Sedang Tangani Konflik Manusia dengan Harimau, Tim Resor KSDA Agam Temukan Tanaman LangkaKepala Resor Balai Konservasi Sumber Daya Alam (KSDA) Agam, Ade Putra mengatakan, saat ini Tim KSDA Agam sedang mengumpulkan data mengingat kejadian sudah berlangsung satu bulan lalu. Kita sedang mencoba mengumpulkan informasi, dan akan berkoordinasi dengan instansi terkait lainnya, jelas Ade Putra.Sebelumnya di Kabupaten Pasaman Barat juga dilaporkan puluhan babi mati secara mendadak pada 2020.Sementara itu, Kepala Bidang Kesehatan Hewan dan Kesehatan Masyarakat Veteriner Dinas Pertanian (Distan) Agam, Farid Muslim mengatakan, pihaknya belum mendapatkan laporan kematian babi dari warga dan apabila memang nanti ditemukan babi mati mendadak perlu dilakukan pengambilan sampel organ tubuh babi tersebut untuk dilakukan uji labor di Balai Veteriner, sehingga dapat diketahui apakah terpapar African Swine Fever (ASF) atau virus flu babi Afrika atau tidak.Kita sedang mengumpulkan data. Belum bisa dipastikan karena perlu uji labor terhadap sampel organ tubuh babi tersebut, katanya.Farid menjelaskan, tanda-tanda klinis ASF berupa kemerahan di bagian perut, dada, scrotum, diare berdarah, berkumpul bersama dan kemerahan pada telinga, demam (41derajat celcius), konjungtivitis, anoreksia, ataksia, paresis, kejang, kadang-kadang muntah, diare atau sembelit.Baca Juga:Inovasi BPJamsostek, Makin Kokoh Melindungi Pekerja dari Masa ke MasaPendarahan kulit sianosis, babi menjadi tertekan, telentang, kesulitan bernapas, tidak mau makan.Ia mengimbuhkan, ASF dapat menyebar melalui kontak langsung, serangga, pakaian, peralatan peternakan, kendaraan dan lainnya. Untuk babi yang terkena penyakit ASF, isolasi hewan sakit dan peralatan serta dilakukan pengosongan kandang selama dua bulan.Untuk babi yang mati karena penyakit ASF dimasukkan ke dalam kantong dan harus segera dikubur oleh petugas untuk mencegah penularan yang lebih luas, katanya.Pada 2019, Kementerian Pertanian menyatakan Indonesia dalam siaga satu menghadapi virus flu babi ini, berbagai langkah dengan melibatkan para pihak telah dilakukan dalam upaya mencegah dan penanganannya. (Antara)BERITA TERKAITREKOMENDASINewsTerkini;05/12/2021;;
146;N152;kalimantan barat;tribun_pontianak;https://pontianak.tribunnews.com/2022/03/03/disbunnak-kabupaten-sanggau-sebut-24216-ekor-babimati-akibat-terserang-african-swine-fever;"""babi"" ""mati"" ""2021""";15/10/2024;domestic;Tayang: Kamis, 3 Maret 2022 11:46 WIB;Disbunnak Kabupaten Sanggau Sebut 24.216 Ekor Babi Mati Akibat Terserang African Swine Fever;TRIBUNPONTIANAK.CO.ID, SANGGAU - Kepala Dinas Perkebunan dan Peternakan (Disbunnak) Kabupaten Sanggau, H Syafriansyah menyampaikan bahwa dari September 2021 hingga Januari 2022 sebanyak 24.216 ekor babi di Kabupaten Sanggau yang mati akibat terserang penyakit ASF (African Swine Fever).Jadi dengan sangat sedih dan berat hati kita sampaikan bahwa kasus ASF sudah sampai di Sanggau. Secara ilmiah ini sudah dibuktikan dengan kita sudah mengirimkan sampel hewan ternak yang mati ke Balai Veteriner Banjarbaru, dan hasilnya menunjukan hasil positif ASF, katanya, Kamis 3 Februari 2022.Dikatakannya, Sebelum dilakukan tes tersebut sebenarnya pada September 2021 sudah ada kematian ternak babi secara sporadis di Kampung-kampung di Kabupaten Sanggau.• 124 Orang Terkonfirmasi Positif Covid-19 di Sanggau, Semuanya Jalani Isolasi MandiriTetapi pada saat itu kita masih belum memastikan, karena secara laboratoris belum dites. Ternyata setelah kita kirim sampel pada Desember dan Januari lalu, Kebetulan sampel kemarin dari Kecamatan Entikong, Kecamatan Noyan, dan Sekayam. Semuanya positif ASF, jelasnya.Dikatakannya, Berdasarkan informasi dari masyarakat dan data dari petugas peternakan Kecamatan sejak bulan September 2021 hingga Januari 2022, Sebelumnya populasi awal jumlah babi di Kabupaten Sanggau ini sebanyak 34.594 ekor babi. Jumlah kematian ternak babi sebanyak 24.216 ekor dan populasi akhir sampai Januari 2022 sebanyak 10.378 ekor babi.Kematian ternak babi terbanyak di Kecamatan Mukok dengan jumlah 3.077 ekor, kemudian di Kecamatan Parindu sebanyak 2.587 ekor dan paling sedikit di Kecamatan Beduai 958 ekor. Kecamatan Toba sebanyak 1.713 ekor, Meliau sebanyak 1.812 ekor, Kapuas sebanyak 1.245 ekor.Kemudian di Kecamatan Jangkang sebanyak 1.971 ekor, Kecamatan Bonti sebanyak 1.270 ekor, Tayan Hilir sebanyak 1.484 ekor, Balai sebanyak 1.929 ekor, Tayan Hulu sebanyak 1.073 ekor, Kembayan 1.383 ekor, Noyan sebanyak 1.390 ekor, Sekayam sebanyak 1.047 ekor, dan Entikong sebanyak 1.278 ekor.Langkah yang dilakukan, Secara fungsional dari Disbunnak Sanggau menurunkan tim untuk mengedukasi masyarakat dengan cara Komunikasi, Informasi dan Edukasi (KIE) terutama untuk Daerah-daerah yang kebetulan belum terjadi serangan secara masif diminta untuk disinfektan kandang.Dan juga kita mendapat bantuan penyuntik serum konvalesen, Mudah-mudahan ini bisa memberikan kekebalan tubuh bagi Babi,ujarnya.Ia juga menambahkan, virus ASF ini tidak bersifat zoonosis. Jadi istilahnya tidak berpeluang menular kepada manusia.Lain dengan virus rabies, Kalau rabies itu bisa menular kepada manusia,pungkasnya. (*)[Update informasi Seputar Kabupaten Sanggau];03/03/2022;;
147;N153;kalimantan barat;harian_berkat;https://harianberkat.com/2022/03/03/diduga-serangan-virus-asf-24-216-ekor-babi-mati-mendadak-di-sanggau/;"""babi"" ""mati"" ""2021""";15/10/2024;domestic;Kamis 3 Maret 2022;Diduga Serangan Virus ASF, 24.216 Ekor Babi Mati Mendadak di Sanggau - Harian Berkat;HARIAN BERKAT – Kepala Dinas Perkebunan dan Peternakan (Bunnak) Sanggau H. Syafriansah membenarkan matinya ribuan babi tersebut. Berdasarkan data yang diterima awak media, kematian ribuan ternak babi itu terjadi sejak September 2021.“Kalau jumlah pasti ternak babi yang diserang virus flu babi ini kami belum tahu pasti, tapi berdasarkan data sampel yang kami kirim ke laboratorium Bivet Banjar Baru dari Tiga Kecamatan yakni Kecamatan Sekayam, Noyan dan Entikong, semuanya positif ASF atau flu babi,” ujar Syafriansah, Rabu 2 Februari 2022.Syafriansah menyebut, sejak kasus flu babi terjadi pada bulan September 2021 lalu, ribuan ternak babi mati mendadak. Populasi ternak babi pun terus menurun. Semula 34.594 ekor, kini hanya tersisa 10.378 ekor. Hal itu dikarenakan 24.216 ekor babi mati mendadak.“Ini data September 2021 hingga Januari 2022 ya. Yang jelas secara ekonomi peternak kita mengalami kerugian cukup besar,” ungkapnya.;03/03/2022;;
121;N126;sumatera barat;suara_sumbar;https://sumbar.suara.com/read/2021/12/23/121500/puluhan-ekor-babi-mati-mendadak-di-agam-positif-terpapar-virus-flu-babi-afrika;"babi hutan ""mati"" ""2021""";15/10/2024;wild;Kamis, 23 Desember 2021 | 12:15 WIB;Puluhan Ekor Babi Mati Mendadak di Agam Positif Terpapar Virus Flu Babi Afrika;SuaraSumbar.id - Puluhan ekor babi hutan mati mendadak di kawasan Maua Hilia, Jorong Kayu Pasak Timur, Nagari Salareh Aia, Kecamatan Palembayan, Kabupaten Agam, Sumatera Barat (Sumbar), positif terpapar virus African Swine Fever (ASF) atau virus flu babi Afrika. Hal ini diketahui dari hasil pemeriksaan sampel organ tubuh babi tersebut.Ini berdasarkan investigasi lapangan Balai Veteriner Bukittinggi yang dikirimkan, namun kami tidak mengetahui hasil laboratorium terkait metode dan jenis virus itu, kata Kepala Bidang Kesehatan Hewan dan Kesehatan Masyarakat Veteriner Dinas Pertanian Agam, Farid Muslim, Kamis (23/12/2021).Menurutnya, sampel babi yang mati secara mendadak itu diambil oleh tim gabungan berasal dari Balai Veteriner Bukittinggi, Balai Konservasi Sumber Daya Alam (BKSDA) Sumbar, Dinas Peternakan, Kesehatan Hewan Sumbar pada Rabu (8/12/2021).Tim gabungan mengambil sampel berupa tulang tengkorak, tulang bagian tubuh lainnya, tanah lokasi babi mati mendadak dan sumber air setelah mendapat laporan dari warga adanya puluhan babi mati mendadak.Baca Juga:912 Ton Ikan Mati di Danau Maninjau, Kerugian Capai Rp 18 Miliar LebihTim menemukan dua organ tubuh babi dan salah satu sampel tulang babi yang diambil itu positif ASF, katanya.Dengan kondisi itu, ia mengimbau warga jika menemukan babi mati mendadak untuk melaporkan ke UPTD Puskeswan terdekat.Ini dalam rangka mencegah penularan virus tersebut ke hewan liar lainnya.Di Agam tidak ada peternak babi, dan kita mewaspadai menular ke hewan lainnya, karena virus itu tidak bisa menular ke manusia, katanya.Sebelumya, warga Maua Hilia Jorong Kayu Pasak Timur, Nagari Salareh Aia, Kecamatan Palembayan, dihebohkan dengan ditemukannya puluhan bangkai babi di lahan perkebunan mereka.Baca Juga:350 Ton Ikan Keramba Danau Maninjau Mati Lagi, Total 912 TonTemuan bangkai babi tersebut terjadi semenjak tiga bulan lalu.Kematian babi liar secara mendadak ini merupakan yang pertama di Agam, katanya. (Antara)BERITA TERKAITREKOMENDASINewsTerkini;23/12/2021;;
150;N156;lampung;kupastuntas;https://kupastuntas.co/2022/01/03/kupas-tv-babi-celeng-mati-tanpa-sebab-warga-tanggamus-khawatir-penyakit-menular;"babi ""hutan"" ""mati"" ""2022""";15/10/2024;wild;Senin, 03 Januari 2022 - 16.32 WIB;KUPAS TV : Babi Celeng Mati Tanpa Sebab, Warga Tanggamus Khawatir Penyakit Menular;Tanggamus - Masyarakat Pekon Tampang Tua, Tampang Muda, dan Pekon Martanda, Kecamatan Pematangsawa, Kabupaten Tanggamus dikejutkan dengan kematian belasan babi hutan secara misterius.Jalan Turi Raya, No. 101, Tanjung Senang, Kota Bandar Lampung, Lampung.(0721) 773331kupastuntas7@gmail.com© kupastuntas.co All Right Reserved;03/01/2022;;
149;N155;kalimantan utara;koran_kaltara;https://korankaltara.com/diduga-terjangkit-virus-asf-puluhan-babi-di-krayan-mati-mendadak;"babi ""hutan"" ""mati"" ""2022""";15/10/2024;wild;Rabu, 14 September 2022;Diduga Terjangkit  Virus ASF, Puluhan Babi di Krayan Mati Mendadak;NUNUKAN, Koran Kaltara – Puluhan babi di wilayah Krayan ditemukan mati mendadak. Namun, Dinas Pertanian dan Ketahanan Pangan (DPKP) Nunukan masih belum bisa memastikan penyebab kematian babi tersebut.Menurut Kabid Perternakan DPKP Nunukan Alim Bahri, bahwa sampai saat ini pihaknya masih menunggu hasil uji  laboratorium dari sampel babi tersebut.Kita sudah investigasi. Kita sudah ambil sampelnya dan dikirim ke laboratorium Banjarbaru. Mudah-mudahan, satu atau dua minggu ini hasilnya sudah keluar, ungkapnya, Senin (14/6/2021).Dia mengungkapkan apabila melihat sebelum dan setelah kematian babi tersebut, maka diduga terjangkit virus flu babi Afrika atau African Swine Fever (ASF).Kita lihat posisi hidup dan matinya. Untuk mati kita bisa lihat dari perubahan lima organnya. Mulai dari jantung, paru-paru, ginjal dan lainya. Termasuk tulangnya kita periksa, jelasnya.Menurut dia, sampai saat ini kasus kematian babi di Krayan mencapai 24 ekor. Khususnya, di Desa Wa Yagung, Krayan. Sebanyak 6 ekor merupakan babi hutan. Selebihnya babi peternakan milik warga.Peternakan babi secara individual saja, tidak banyak. Paling satu keluarga ternak satu hingga dua ekor saja karena babi yang mereka ternak itu untuk dikonsumsi sendiri, ujarnya.Selain di Krayan, kata dia, kematian babi juga ditemukan di Tulin Onsoi. Namun di sana bukan termasuk ASF. Kematian babi di Tulin Onsoi itu dikarenakan bakteri atau Septicemia epizootica (SE).Di Tulin Onsoi, kita tidak sempat lihat bagaimana fisiknya setelah mati karena kita temukan bangkainya sudah rusak. Tapi, tetap kita telusuri dan akan dikembangkan lagi, bebernya.Dia menyampaikan babi hutan yang mati di Tulin Onsoi ditemukan jauh dari pemungkiman warga.  Di Tulin Onsoi itu bukan ASF. Kematian di Tulin Onsoi itu sudah ada vaksinnya, bebernya.Berbeda dengan ASF, kata dia, persentase kematiannya 100 persen. Sebab, belum ada vaksin untuk ASF. Kalau di Tulin Onsoi masih bisa ditangani. ASF ini menular sesama babi. Nah, kalau di Tulin Onsoi itu bakteri, bisa terkena kerbau, kambing, dan sapi, jelasnya.Dia menjelaskan, babi yang terjangkit ASF biasanya mengalami demam tinggi dan nafsu makan hilang. Bahkan, masa inkubasinya tiga hingga empat hari, lalu mati. Secara kasat mata, babi terjangkit ASF bisa terlihat dari bagian hidungnya yang mengeluarkan cairan.“Meski menular sesama babi, namun penularan ASF bisa melalui kontak langsung, serangga, pakaian, peralatan peternakan, kendaraan dan pakaian yang terkontaminasi. Jika dikonsumsi manusia, maka akan berbahaya, meskipun lebih efektif sesama babi. Tapi, Alhamdulilah, belum ada kasus menular ke manusia, jelasnya.Dia telah mengimbau untuk menghentikan pemburuan babi di hutan. Sebab, hal itu berisiko tinggi membawa virus tersebut.“Kita telah mengedukasi masyarakat, yakni pencucian dan penyemprotan kandang dengan desinfektan, Seperti cresol, NaOH 2 persen, formalin 1 persen, sodium karbonat, choloroform, iodofor, asam phospor, dan detergent non ionik. Ini bisa membasmi virus ASF, ungkapnya.  (*)Reporter: AsrinEditor: Sobirin;14/09/2022;;
151;N157;kalimantan barat;betahita;https://betahita.id/news/lipsus/7158/serangan-afs-di-kalbar-akibatkan-44-ribu-ekor-babi-mati.html?v=1645276570;"""babi"" ""mati"" ""2022""";15/10/2024;domestic;Sabtu, 19 Februari 2022;Serangan ASF di Kalbar akibatkan 44 Ribu Ekor Babi Mati;"BETAHITA.ID -African Swine Fever(ASF) juga menyerang sejumlah kabupaten dan kota di Provinsi Kalimantan Barat (Kalbar). Di provinsi itu serangan ASF telah mengakibatkan sekitar 44.321 ekor babi mati. Hal tersebut berdasarkan data yang diririls Dinas Pangan Peternakan dan Kesehatan Hewan Kalbar pada 8 Februari 2022 lalu. ""Untuk Kalimantan Barat sendiri kasus pertama kali di Kabupaten Kapuas Hulu, Desa Datah Dian pada September 2021, dan menyebar ke Kabupaten Sintang dan Melawi,"" kata M. Munif, Kepala Dinas Pangan Peternakan dan Kesehatan Hewan Kalbar, dikutip dari HiPontianak, Kamis (17/2/2022).
Munif menjelaskan, pada gelombang pertama, September 2021, kasus kematian babi terjadi di 3 kabupaten, yaitu Kabupaten Kapuas Hulu, Sintang dan Melawi dengan kematian babi yang terjadi sebanyak 460 ekor. Kemudian pada gelombang kedua, Desember 2021, babi yang mati akibat ASF ini mencapai 11.845 ekor. Kabupaten terdampak bertambah setelah virus tersebut dilaporkan mengakibatkan kematian babi di Kabupaten Landak, Mempawah, Kubu Raya dan Singkawang. Terakhir gelombang ketiga, 31 Januari 2022, total kematian babi akibat ASF bertambah menjadi 17.845 ekor dan terjadi lonjakan pada 8 Februari 2022 menjadi 44.321 ekor dengan wilayah terdampak 10 kabupaten atau kota. ""Daerah yang paling terdampak adanya ASF berdasarkan data yang terangkum wilayah yang paling merasakan dampak kejadian penyakit ASF adalah Sanggau dengan jumlah kematian mencapai 24.206 ekor, diikuti Sintang 7.030 ekor, Landak 6.318 ekor dan Mempawah 3.416 ekor. ""Penyakit ASF ini dapat diidentifikasi pada ternak babi dengan ciri-ciri, tanda merah kebiruan pada kulit, muntah dan terjadi pendarahan pada seluruh organ. Diawali dengan limpa serta keluar darah dari lubang alami. ""Kejadian awal penyakit ASF selalu diawali dengan tidak mau makan dan lemas. Ciri-ciri penyakit ASF ini menyerupai CSF/Hog Cholera namun tingkat mortalitas mencapai 100 persen,"" terang Munif. Ia menyebut, faktor penularan ASF ini dapat terjadi secara kontak langsung, yaitu terinfeksi dari babi yang terkena ASF, maupun kontak tidak langsung melalui sweeling feeding, pakan, orang dan vektor seperti serangga. ""Lalu lintas ternak babi melalui jalur legal, disparitas harga. Lalu lintas fomite (kendaraan, orang). Kontaminasi pakan. Babi liar.""";19/02/2022;;
152;N158;ntt;antara_ntt;https://kupang.antaranews.com/berita/92321/pemprov-ntt-catat-122000-ekor-babi-mati-akibat-serangan-virus-asf;"""babi"" ""mati"" ""2022""";15/10/2024;domestic;Selasa, 26 Juli 2022 13:35 WIB;Pemprov NTT catat 122.000 ekor babi mati akibat serangan virus ASF;Disebutkan, kematian puluhan ribu babi akibat serangan gelombang ketiga flu babi Afrika yang melanda Kalbar. Ada 10 kabupaten kota yang ada mengalami serangan ASF ini, yakni Kabupaten Kapuas Hulu, Sintang, Melawi, Sekadau, Sanggau, Landak, Bengkayang, Mempawah, Singkawang dan Kubu Raya.;26/07/2022;;
153;N159;kalimantan barat;kompas_regional;https://regional.kompas.com/read/2022/02/17/172140078/44322-ekor-babi-di-kalbar-mati-karena-terinfeksi-flu-afrika;"""babi"" ""mati"" ""2022""";15/10/2024;domestic;Kompas.com - 17/02/2022, 17:21 WIB;44.322 Ekor Babi di Kalbar Mati karena Terinfeksi Flu Afrika;ASF sendiri merupakan penyakit menular dan mematikan bagi babi, yang disebabkan oleh virus. Virus ini termasuk DNA yang mempunyai spesifikasi asfviridae. Namun, penyakit yang ditimbulkan oleh virus tersebut bukan merupakan penyakit zoonosis yang mampu menular dari hewan kepada manusia, maupun sebaliknya.;17/02/2022;;
154;N160;sumatera utara;kumparan;https://kumparan.com/kumparannews/2-000-babi-di-medan-mati-mendadak-akibat-flu-babi-peternak-rugi-rp-12-miliar-1zMBAvQEP54/full;"""babi"" ""mati"" ""2022""";15/10/2024;domestic;1 Desember 2022 21:58 WIB;2.000 Babi di Medan Mati Mendadak Akibat Flu Babi, Peternak Rugi Rp 12 Miliar;Akan tetapi penyakit ini memiliki tingkat kematian yang mencapai 100 persen. Sampai saat ini ASF yang hanya menyerang babi ini belum ditemukan obatnya, begitu juga dengan vaksinnya. Walaupun tidak membahayakan manusia, apabila tidak diputus mata rantainya dan berulang kali terjadi, penyakit ini tentu dapat mengakibatkan kerugian sektor sosial dan ekonomi.;01/12/2022;;
155;N161;kalimantan utara;sindo_news;https://daerah.sindonews.com/read/709421/174/ratusan-ekor-babi-di-bartim-mati-terpapar-asf-belum-ada-penanganan-pemerintah-1646971386;"""babi"" ""mati"" ""2022""";15/10/2024;domestic;Jum'at, 11 Maret 2022 - 11:24 WIB;Ratusan Ekor Babi di Bartim Mati Terpapar ASF, Belum Ada Penanganan Pemerintah;BARITO TIMUR - Kasus kematian  babi  akibat terpapar African Swine Fever (ASF) atau demam babi Afrika di Kabupaten Barito Timur (Bartim) Kalimantan Tengah (Kalteng) terus meningkat dua minggu terakhir. Pemerintah belum melakukan tindakan terkait kasus ASF ini.Kades Gumpa, Salakman mengungkapkan, kasus kematian babi di desanya mulai muncul sejak dua minggu yang lalu. Kematian tersebut terus meningkat hingga mencapai sekitar 200 ekor.                                     Baca Juga                                                                                                                                                                Harga Daging Babi Naik, Warga Thailand Beralih ke Daging Buaya                                                             Biasanya tiga hari demam langsung mati. Sampai saat ini belum ada penanganan, kalau babi mati biasanya warga langsung kubur, ungkapnya.Sejumlah desa yang mengalami kasus ASF yakni Desa Lalap, Kotam dan Ampari Bura di Kecamatan Patangkep Tutui dan Desa Gumpa dan Desa Matarah di Kecamatan Dusun Timur.Babi yang mati di Desa Gumpa rata-rata sudah besar, karena itu Salakman memperkirakan total kerugian akibat kematian babi mencapai ratusan juta rupiah.Kita rata-rata saja per ekor babi yang mati beratnya 30 kilogram, dikalikan 200 ekor, kemudian dikalikan harga daging babi Rp45 ribu per kilogram, urainya.                                     Baca Juga                                                                                                                                                                Kelaparan Babi Hutan Masuk Permukiman Bikin Panik Warga Hambalang Bogor                                                             Camat Patangkep Tutui, Nina Marissa membenarkan adanya kasus ASF di beberapa desa. Namun hingga kini Nina belum mendapatkan laporan dari pemerintah desa jumlah kematian babi. Belum ada laporan masuk ke kami, mungkin ke dinas terkait, jawabnya saat dihubungi MNC Portal Jumat, (12/3/2022). Terpisah, Dokter Hewan Akhmad Rizaldi mengatakan, tanda klinis babi yang terpapar  ASF yakni kemerahan di bagian perut, dada dan scrotum. Selain itu, babi juga mengalami diare berdarah, kemerahan pada telinga, demam 41 derajat celsius, konjungtivitis, anoreksia, ataksia, paresis dan kejang.Kadang babi juga mengalami muntah, diare atau sembelit, pendarahan kulit sianosis yang menyebabkan babi menjadi tertekan, telentang, kesulitan bernapas dan tidak mau makan.Virus ASF juga sangat tahan hidup di cuaca dingin maupun panas, serta relatif lebih tahan terhadap disinfektan. Virus ini dapat menyebar melalui kontak langsung serangga, pakaian, peralatan peternakan, kendaraan dan pakan yang terkontaminasi seperti limbah bekas catering yang mengandung daging babi.Hingga saat ini belum ditemukan vaksin untuk pencegahan ASF, karena itu peternak harus mewaspadai penyebaran ASF. Penyakit ini penularannya cepat dan dapat menyebabkan kematian pada babi hingga 100 persen, sehingga mengakibatkan kerugian ekonomi yang sangat besar, bebernya.Data terakhir yang dirilis Dinas Perikanan dan Peternakan Barito Timur pada 16 Februari 2022, jumlah kematian babi telah mencapai 1.528 ekor. Rinciannya, dari Kecamatan Awang 1.147 ekor, Dusun Timur 167 ekor dan Kecamatan Benua Lima 214 ekor.                            Lihat Juga: 5 Sapi Kelompok Tani Rukun Gunungpati Mati Mendadak, Polisi Turun Tangan            (don);11/03/2022;;
156;N162;ntt;medcom;https://www.medcom.id/nasional/daerah/ybDDEBAb-122-ribu-ternak-babi-di-ntt-mati-terjangkit-virus;"""babi"" ""mati"" ""2022""";15/10/2024;domestic;Media Indonesia.com • 26 Juli 2022 15:15;122 Ribu Ternak Babi di NTT Mati Terjangkit Virus;Kupang: Dinas Peternakan Provinsi Nusa Tenggara Timur (NTT) mencatat sebanyak 122.000 ekor babi mati akibat serangan virus demam babi Afrika atau African Swine Fever (ASF) wilayah itu.Jumlah ternak babi yang mati akibat virus ASF yang dilaporkan secara resmi ke kami sekitar 122.000 ekor yang tersebar di 22 kabupaten/kota, kata Kepala Dinas Peternakan NTT Johanna Lisapaly di Kupang, Selasa, 26 Juli 2022.Lisapaly mengatakan nilai kerugian akibat penyakit yang menyerang ternak babi di NTT mencapai ratusan miliar rupiah. Pemerintah, kata dia, telah melakukan berbagai upaya pencegahan dan pengendalian untuk mengatasi penyebaran ASF, seperti sosialisasi ke masyarakat peternak agar menghindari persilangan (perkawinan) babi lokal dengan babi dari luar.Selain itu, lanjutnya, edukasi untuk menjaga sanitasi atau kebersihan kandang secara intensif maupun mengeluarkan kebijakan untuk melarang pasokan babi dari luar masuk ke daerah-daerah. Menurut Lisapaly, setelah berbagai upaya yang dilakukan, tidak ada lagi laporan kematian babi akibat ASF hingga Juli 2022. Lebih lanjut, saat ini pemerintah provinsi juga berupaya membangkitkan kembali industri peternakan babi di NTT melalui gerakan bertajuk 'Kampanye Kesadaran ASF dan Penyakit Hewan Menular Lainnya' bersama pihak Prisma Indonesia.Langkah ini diharapkan memberikan motivasi bagi masyarakat maupun pelaku usaha untuk kembali mengembangkan peternakan babi untuk mendapatkan manfaat secara ekonomi maupun sosial dan budaya.Ternak babi memiliki berbagai manfaat yang strategis bagi masyarakat karena itu masyarakat tak perlu takut lagi untuk kembali mengembangkannya dengan tetap waspada terhadap serangan penyakit, jelasnya.;26/07/2022;;
157;N163;sumatera utara;analisadaily;https://analisadaily.com/berita/baca/2022/11/30/1036678/jelang-nataru-2-000-babi-di-medan-dan-deliserdang-mati-mendadak/;"""babi"" ""mati"" ""2022""";15/10/2024;domestic;Rabu, 30 Nov 2022 20:45 WIB;Jelang Nataru, 2.000 Babi di Medan dan Deliserdang Mati Mendadak;Analisadaily.com, Medan - Jelang Natal 2022 dan Tahun Baru 2023 (Nataru) tercatat 2.000 ekor babi di Kota Medan dan di Kabupaten Deliserdang mendadak mati, disebabkan flu babi.Analisadaily.com adalah media online yang berkantor pusat di Medan. Analisadaily dikelola oleh PT. Media Warta Digital dan merupakan bagian dari kelompok usaha Analisa Group (Harian Analisa)Analisadaily.com ©2024 • All rights reserved.;30/11/2022;;
