no;doc_id;province;source_web;url;key_word;date_access;species;news_publish;news_title;news_content;clean_date;;
63;N064;ntt;ayojakarta;https://www.ayojakarta.com/nasional/pr-76753366/22-Ribu-Babi-Mati-Diserang-Virus-ASF;"babi ""mati"" ""jakarta"" ""2020""";14/10/2024;domestic;- Sabtu, 4 Juli 2020 | 09:28 WIB;22 Ribu Babi Mati Diserang Virus ASF;NTT, AYOJAKARTA.COM - Sekretaris Dinas Peternakan Nusa Tenggara Timur (NTT), Frans Samon mengatakan, hingga akhir Juni 2020 jumlah babi yang mati akibat terserang virus African Swine Fever (ASF) atau demam babi Afrika sudah mencapai 22.000-an ekor. Kondisi itu sangat meresahkan warga, terutama pemilik ternak.Keresahan semakin menjadi saat demam babi tak hanya menyerang di Timor, namun merambah ke wilayah lain yanki sampai ke Sumba, Alor bahkan sampai di Flores khususnya di Kabupaten Sikka.Sebelumnya Pulau Timor terbanyak kasus babi yang mati akibat virus itu, tetapi saat ini justru sudah menyebar sampai ke beberapa pulau lain di NTT ini, tutur dia, Jumat (3/7/2020).Ia mengatakan bahwa selama ini Dinas Peternakan NTT sudah membentuk tim khusus dan mengawasi peredaran daging babi, namun pihaknya kesulitan karena memang pihaknya tak bisa memantau satu-persatu warga yang membeli daging babi.AYO BACA : Permintaan Tinggi, Daging Babi Rawan Masuk Pasar Tradisional di TasikmalayaOleh karena itu bisa saja, penyakit babi yang sudah ada pulau Timur dibawa ke pulau lain di NTT sehingga beberapa babi di pulau-pulau tersebut juga terjangkit.Pihaknya kata dia, juga sudah mengimbau agar pembelian daging babi hanya boleh dilakukan di rumah pemotongan hewan (RPH) yang memang semua hewan yang akan dipotong sudah diperiksa kesehatannya terlebih dahulu.Namun sayangnya penjualan daging babi di Kota Kupang saja, menyebar di mana-mana, sehingga pihaknya juga kesulitan mengawasi atau mencegahnya.Ia juga mengatakan informasi terakhir menyebutkan bahwa ada ratusan babi di Sikka juga sudah mati akibat wabah virus ASF tersebut yang memang sangat meresahkan.AYO BACA : Remaja di India Meninggal Setelah Makan Daging Babi Kurang MatangEditor: Fitria RahmawatiPT Ayo Media JakartaJalan Tebet Barat Dalam II D No 17, Kecamatan Tebet, Jakarta Selatan 12810  (021) 8598159  [email protected]©2025 PTI;04/07/2020;;
64;N065;ntt;detik;https://news.detik.com/berita/d-4995508/6-998-ekor-babi-di-pulau-timor-ntt-mati-akibat-virus-asf;"babi ""mati"" ""jakarta"" ""2020""";14/10/2024;domestic;Rabu, 29 Apr 2020 11:13 WIB;6.998 Ekor Babi di Pulau Timor NTT Mati Akibat Virus ASF;Dinas Peternakan Provinsi Nusa Tenggara Timur (NTT) mencatat 6.998 ekor babi ternak milik warga mati akibat terserang virus African Swine Fever (ASF). Jumlah kematian babi terus bertambah.Virus ASF memang masih menyerang ternak babi milik warga, terutama Pulau Timor. Kami mencatat hingga kini kasus kematian mencapai 6.998 ekor, kata Kepala Dinas Peternakan NTT Dani Suhadi kepada wartawan di Kupang, seperti dilansir Antara, Rabu (29/4/2020).Dia mengatakan, pada pertengahan Maret lalu, jumlah babi yang mati sekitar 4.800 ekor. Dani mengatakan serangan virus ASF yang menyebabkan ribuan ekor babi mati itu terjadi pada semua wilayah di Pulau Timor, dengan kasus terbanyak terjadi di Kabupaten Kupang.ADVERTISEMENTSCROLL TO CONTINUE WITH CONTENTKasus kematian ini tidak hanya melanda ternak babi milik warga, tetapi juga di pusat pembibitan milik pemerintah, katanya.Menurutnya, ribuan kasus kematian babi tersebut menimbulkan keresahan bagi masyarakat atau peternak karena membuat mereka kehilangan sumber pendapatan untuk menunjang kebutuhan ekonomi rumah tangga.Dinas Peternakan bersama DPRD NTT telah membahas upaya penanganan dampak ekonomi terkait serangan virus ASF ini terhadap para peternak.Kami sudah bahas bersama dewan, jadi ada realokasi anggaran yang dilakukan dan itu diharapkan tidak keluar dari upaya penanganan keluarga peternak yang terdampak ASF, katanya.Dani Suhadi menambahkan realokasi anggaran ini juga terintegrasi dengan bantuan untuk keluarga peternak yang terdampak dari serangan wabah COVID-19.;29/04/2020;;
65;N066;ntt;antara_ntt;https://kupang.antaranews.com/berita/35186/puluhan-ribu-ternak-babi-di-ntt-mati-terserang-virus-asf;"babi ""mati"" ""jakarta"" ""2020""";14/10/2024;domestic;Sabtu, 4 Juli 2020 9:40 WIB;Puluhan ribu ternak  babi di NTT mati terserang  virus ASF;Kupang (ANTARA) - Dinas Peternakan Nusa Tenggara Timur melaporkan bahwa hingga akhir Juni 2020 jumlah babi yang mati akibat terserang virus African Swine Fever (ASF) atau demam babi Afrika sudah mencapai 22.000-an ekor.Data terakhir mencapai 22 ribuan babi yang sudah mati, angka pastinya saya agak lupa, kata Sekretaris Dinas Peternakan NTT Frans Samon kepada ANTARA di Kupang, Jumat, (3/7).Baca juga: Menteri Pertanian bantu obat-obatan atasi flu babi di NTTIa mengatakan hal ini berkaitan dengan perkembangan kasus matinya babi di NTT yang cukup meresahkan seluruh masyarakat di provinsi berbasis kepulauan itu.Frans mengatakan bahwa saat ini penyebaran virus demam babi Afrika itu tidak hanya terjadi di pulau Timor saja, tetepi justru sudah menyebar sampai ke Sumba, Alor bahkan sampai di Flores khususnya di Kabupaten Sikka.Sebelumnya Pulau Timor terbanyak kasus babi yang mati akibat virus itu, tetapi saat ini justru sudah menyebar sampai ke beberapa pulau lain di NTT ini, tutur dia.Ia mengatakan bahwa selama ini Dinas Peternakan NTT sudah membentuk tim khusus dan mengawasi peredaran daging babi, namun pihaknya kesulitan karena memang pihaknya tak bisa memantau satu-persatu warga yang membeli daging babi.Oleh karena itu bisa saja, penyakit babi yang sudah ada pulau Timur dibawa ke pulau lain di NTT sehingga beberapa babi di pulau-pulau tersebut juga terjangkit.Pihaknya kata dia, juga sudah mengimbau agar pembelian daging babi hanya boleh dilakukan di rumah pemotongan hewan (RPH) yang memang semua hewan yang akan dipotong sudah diperiksa kesehatannya terlebih dahulu.Baca juga: Cegah virus ASF, Pasokan ternak babi dilarang masuk Flores TimurBaca juga: Pemerintah tutup lalu lintas ternak babi dari dan ke NTTNamun sayangnya penjualan daging babi di Kota Kupang saja, menyebar di mana-mana, sehingga pihaknya juga kesulitan mengawasi atau mencegahnya.Ia juga mengatakan informasi terakhir menyebutkan bahwa ada ratusan babi di Sikka juga sudah mati akibat wabah virus ASF tersebut yang memang sangat meresahkan.;04/07/2020;;
66;N067;ntt;kompas_regional;https://regional.kompas.com/read/2020/04/29/09384711/6998-ekor-babi-di-pulau-timor-ntt-mati-diserang-virus-asf?page=all;"babi ""mati"" ""jakarta"" ""2020""";14/10/2024;domestic;Kompas.com - 29/04/2020, 09:38 WIB;6.998 Ekor Babi di Pulau Timor, NTT, Mati Diserang Virus ASF;6.998 Ekor Babi di Pulau Timor, NTT, Mati Diserang Virus ASFEditorKOMPAS.com - Sebanyak 6.998 ekor babi milik masyarakat di Pulau Timor, Nusa Tenggara Timur (NTT), mati diserang virus African Swine Fever (ASF) atau flu babi Afrika.“Virus ASF memang masih menyerang ternak babi milik warga terutama Pulau Timor. Kami mencatat hingga kini kasus kematian mencapai 6.998 ekor,” kata Kepala Dinas Peternakan Provinsi NTT Dani Suhadi kepada wartawan di Kupang, dikutip dari Antara, Selasa (28/4/2020).Baca juga: Melihat Perbandingan antara Pandemi Covid-19 dan Pandemi Flu BabiIa menjelaskan, jumlah babi yang mati ini bertambah dari sebelumnya pada pertengahan Maret lalu sekitar 4.800-an ekor.Menurut Dani, serangan virus ASF yang menyebabkan ribuan ekor babi mati itu terjadi di semua wilayah di Pulau Timor.“Kasus kematian ini tidak hanya melanda ternak babi milik warga, tetapi juga di pusat pembibitan milik pemerintah,” katanya.Kasus kematian babi ini menimbulkan keresahan bagi masyarakat atau peternak karena membuat mereka kehilangan sumber pendapatan.Baca juga: Jual Babi untuk Tiket Pulang Anak, Malah Diusir Warga karena Dianggap Bawa Virus CoronaUntuk itu, Pemprov NTT bersama DPRD NTT telah membahas upaya penanganan dampak ekonomi terkait serangan virus ASF ini.“Kami sudah bahas bersama dewan. Jadi ada realokasi anggaran yang dilakukan dan itu diharapkan tidak keluar dari upaya penanganan keluarga peternak yang terdampak ASF,” katanya.Dani menambahkan, realokasi anggaran ini juga terintegrasi dengan bantuan untuk keluarga peternak yang terdampak wabah Covid-19.Kasus kematian babi disebabkan virus ASF juga terjadi di Sumatera Utara.Kematian babi di provinsi ini mulai terjadi 25 September 2019 dan merebak hingga saat. Diketahui puluhan ribu babi sudah mati.Pemerintah melakukan langkah penanganan dengan bio security, di antaranya dengan mengetatkan lalu lintas pemindahan babi dari satu tempat ke tempat lain.Kemudian, tidak membuang bangkai babi ke sungai, hutan ataupun jalanan, dan juga menyemprotkan desinfektan serta menjaga sanitasi kandang dan ternaknya.Copyright 2008 - 2024 PT. Kompas Cyber Media (Kompas Gramedia Digital Group). All Rights Reserved.;29/04/2020;;
67;N068;bali;nusabali;https://www.nusabali.com/berita/67475/puluhan-babi-mati-mendadak-di-jegu;"babi ""mati"" ""jakarta"" ""2020""";14/10/2024;domestic;22/01/2020 08:49;NUSABALI.com                    - Puluhan Babi Mati Mendadak di Jegu;Dinas Pertanian Tabanan telah mengambil sampel dari tiga tempat di Desa Jegu. Sementara peternak ramai-ramai jual babi dengan harga murah.MENSTRUASI merupakan siklus reproduksi yang setiap bulan harus dihadapi perempuan, dari remaja hingga dewasa. Menghadapi tamu bulanan ini terkadang tidak mudah bagi perempuan, karena biasanya disertai beberapa tanda seperti perut kembung, jerawat, perubahan suasana hati yang cepat (moodswing), hingga nyeri punggung di bagian bawah.Nākrocamicchenna mṛṣā vadecca napaiṣunyam janavādaṁ na kuryāt, satyavrato mitabhāṣo pramattastya vagdvāramupaiti guptim. (Sãrasamuccaya, 124)Pojok iklan NusaBali                                Untuk pemasangan iklan, silahkan hubungi                                0361-227410 atau email: [email protected]Copyright © 2024 PT SINAR NUSRAPRESS UTAMA.All Right Reserved.Dapatkan informasi dan berita NusaBali hari ini hanya di NusaBali.com. Yang penting beritanya, Bli!Copyright 2024 PT SINAR NUSRAPRESS UTAMA. All Right Reserved.Back to top;22/01/2020;;
68;N069;bali;kilasbali;https://www.kilasbali.com/2020/02/04/diduga-asf-kasus-kematian-babi-capai-888-ekor/;"babi ""mati"" ""jakarta"" ""2020""";14/10/2024;domestic;Selasa, 4 Februari 2020 | 18:38 WITA;Diduga ASF, Kasus Kematian Babi Capai 888 Ekor;DENPASAR, Kilasbali.com – Dinas Pertanian dan Ketahanan Pangan Provinsi Bali mencatat, 888 ekor babi mati diduga terserang virus African Swine Fever (ASF).Kepala Dinas Pertanian dan Ketahanan Pangan Provinsi Bali, IB Wisnuardhana mengatakan bahwa dari populasi babi di Bali kurang lebih 689 ribu ekor.“Sejak 27 Desember 2019 hingga 27 Januari 2020, tercatat 888 ekor babi yang mati diduga akibat demam Afrika atau ASF,” katanya, Selasa (4/2/2020).Dikatakannya, kematian babi terbanyak ada di Badung yakni sebanyak 598 ekor, disusul Tabanan 219, Denpasar 45, dan Gianyar 24, serta Bangli dan Karangasem masing-masing satu ekor.Menurutnya, hasil penelitian 10 persen sampel yang diambil secara acak oleh Balai Veteriner Denpasar yang kemudian mengirim sampel ke Balai Medan dan dilanjutkan ke Jakarta diduga terkena ASF.“Hasil uji sampelnya sudah keluar dan diduga positif demam babi Afrika atau ASF,” kata Wisnuardhana.Kendatipun demikian, pihaknya mengimbau kepada seluruh masyarakat agar tidak resah. Pasalnya, virus ini sifatnya zonosis. Tidak menular kepada manusia.“Kami telah melakukan sosialisasi kepada masyarakat dengan turun langsung ke lapangan, yakni ke Buleleng, Klungkung, Badung, Denpasar dan Gianyar,” sebutnya.Jadi pakan ternak yang memanfaatkan sisa makanan dari hotel maupaun yang lainnya agar dimasak terlebih dahulu sehingga virus ini mati karena tidak kuat dengan suhu tinggi,” pungkasnya. (jus/kb)Berita ini dilindungi;04/02/2020;;
69;N070;sumatera selatan;pikiranrakyat_depok;https://depok.pikiran-rakyat.com/nasional/pr-09584854/diduga-terserang-demam-babi-afrika-ratusan-babi-di-sumatra-mati-mendadak?page=all;"babi ""mati"" ""jakarta"" ""2020""";14/10/2024;domestic;- 4 Jul 2020, 11:25 WIB;Diduga Terserang Demam Babi Afrika, Ratusan Babi di Sumatra Mati Mendadak;PR DEPOK - Pemerintah Kota Palembang menyelidiki kasus kematian mendadak 878 babi ternak di kawasan Talang Buruk, Kecamatan Alang-Alang Lebar, Kota Palembang.Diduga, babi itu terserang penyakit demam babi afrika atau Africa Swine Faver (ASF).Kepala Seksi Kesehatan Hewan Dinas Pertanian dan Ketahanan Pangan Kota Palembang, drh. Jafrizal di Palembang, Jumat 3 Juli 2020 mengatakan telah mengirimkan sampel swab ke Balai Veteriner Lampung untuk diuji sambil menyelidiki dugaan 878 ekor babi tersebut masuk secara ilegal.Hari ini sampelnya baru dikirim, mungkin pekan depan hasilnya sudah keluar, di Palembang kasus kematian mendadak babi dalam jumlah banyak seperti ini baru pertama kali ini terjadi, kata Jafrizal yang juga Kepala Otoritas Veteriner Kota Palembang sebagaimana dikutip Pikiranrakyat-Depok.com dari Antara.Baca Juga: Kalung Antivirus Corona Buatan Kementan, Dipakai 15 Menit Diklaim Bisa Bunuh 42 Persen VirusDugaan penyakit ASF, menurut dia, muncul berdasarkan tanda fisik tubuh babi saat mati dari keterangan peternak. Babi-babi itu mengalami perdarahan di telinga, bawah kulit, dan kaki.Menurut laporan peternak, semula beberapa babi mati pada Maret 2020. Namun peternak menganggapnya hal biasa. Pada akhir Mei 2020, ratusan babi mati mendadak dengan gejala serupa sehingga peternak menginformasikannya kepada pihak terkait.Akan tetapi, ratusan bangkai babi itu langsung dikubur peternak agar tidak meluas sehingga petugas tidak sempat mengambil sampel langsung. Namun, sampel swab kandang seperti air minum babi dan kotorannya masih dapat diambil untuk diuji.Menurut Jafrizal, probabilitas kematian babi yang disebabkan ASF memang terbilang tinggi, tetapi tidak sampai menular ke manusia seperti flu babi (H1N1) dan masyarakat tidak perlu khawatir.Baca Juga: 5 Manfaat Luar Biasa Cokelat yang Jarang Diketahui, Salah Satunya Tingkatkan Fungsi OtakSelain mengirimkan sampel, dia juga menyelidiki asal datangnya babi sebab peternak hanya mengambil dari pengepul dan keterangand ari pengepul belum bisa digali sehingga diduga masuk secara ilegal.Kami tanyakan apakah babi-babi itu ada surat izinnya atau tidak, karena kalau ada suratnya pasti Dinas Peternakan Sumsel mengizinkan dan harus lewat rekomendasi kami, tetapi selama ini kami tidak pernah terima rekomendasi untuk masuknya babi itu, kata Jafrizal.Dia memperkirakan, babi yang mati mendadak itu berasal dari Medan atau Lampung, sebab di dua wilayah tersebut sudah tercatat adanya temuan kematian babi akibat ASF yang jumlahnya lebih besar.***Sumber: Permenpan RBPT Kolaborasi Mediapreneur Nusantara                                Jl. Asia Afrika No. 75                                 Bandung - Jawa Barat, 40111, Ph. 022-4241600                                Email: [email protected]©2025 Pikiran Rakyat Media Network;04/07/2020;;
70;N071;sumatera selatan;liputan6;https://www.liputan6.com/regional/read/4302822/ratusan-babi-di-palembang-mati-mendadak-dengan-gejala-demam-tinggi;"babi ""mati"" ""jawa barat"" ""2020""";15/10/2024;domestic;Diperbarui 11 Jul 2020, 23:44 WIB;Ratusan Babi di Palembang Mati Mendadak dengan Gejala Demam Tinggi;liputan6Ratusan babi milik peternak di kawasan Talang Buruk Palembang mati mendadak dengan gejala demam tinggi.Diperbarui 11 Jul 2020, 23:44 WIBDiterbitkan 11 Jul 2020, 23:32 WIBLiputan6.com, Palembang - Sebanyak 878 ekor babi mati mendadak di Kota Palembang karena terserang Africa Swine Faver atau Demam Babi Afrika berdasarkan hasil pemeriksaan salah satu sampel yang dikirim ke Balai Veteriner Lampung.Sudah positif untuk daging (sampel) yang dijual di pasar, kalau di kandang sudah tidak ditemukan lagi, ujar Kepala Seksi Kesehatan Hewan Dinas Pertanian dan Ketahanan Pangan Kota Palembang, drh Jafrizal kepada Antara, Sabtu (11/7/2020).Menurut dia, meski mungkin sudah ada yang dikonsumsi oleh warga, daging babi tersebut tetap aman karena jenis penyakit itu hanya menular dari hewan yang sakit ke hewan lainnya, serta belum pernah terbukti menular ke manusia.AdvertisementBaca JugaSebelumnya pada akhir Mei 2020, ratusan babi milik peternak di kawasan Talang Buruk Palembang mati mendadak dengan gejala demam tinggi dan merah pada kulit, namun ternyata kasus tersebut sudah terjadi sejak Maret dan total terdapat 878 ekor babi yang mati.Selain menyelidiki kematian babi yang baru pertama kali terjadi di kota pempek itu, pihaknya juga menyebut masuknya ratusan babi tersebut ilegal, karena tidak memiliki izin dari Dinas Peternakan dan Ketahanan Pangan (DPKP) Sumsel.Harusnya ada izin masuk dari DPKP Sumsel dan surat kesehatan hewan dari daerah asal, sebab babi-babi ini datangnya dari provinsi lain, tambah drh Jafrizal yang juga pejabat otoritas veteriner Kota Palembang.Atas temuan positif dan ilegal tersebut, Pemkot Palembang akan melakukan pembinaan kepada pedagang dan pemasok agar memperhatikan masalah adminstrasi tekait izin masuk serta surat kesehatan hewan.Yang penting diperhatikan adalah dilarang memasukkan hewan dari daerah yang terserang wabah, tambahnya.Pihaknya juga akan meningkatkan pengawasan lalu lintas hewan ternak, meningkatkan usaha desinfekai, dan biosecurity ditempat penampungan dan kandang.WHO menyebut ini bukan virus baru, namun tetap dalam pengawasan ketat.AdvertisementAdvertisementAdvertisementAdvertisement;11/07/2020;;
71;N072;ntt;regional_kontan;https://regional.kontan.co.id/news/sebanyak-2000-babi-di-sumba-timur-mati-diduga-karena-terserang-flu-babi-afrika;"babi ""mati"" ""jawa barat"" ""2020""";15/10/2024;domestic;"Kamis, 16 Juli 2020 | 13:44 WIB 
                                    Sumber: Kompas.com";Sebanyak 2.000 babi di Sumba Timur mati, diduga karena terserang flu babi Afrika;ILUSTRASI. Peternakan babi. KONTAN/Daniel Prabowo/28/04/2009PETERNAKAN - WAINGAPU. Kepala Dinas Peternakan Kabupaten Sumba Timur, NTT, Yohanis Radamuri mengatakan, 2.000 ternak babi di wilayah itu mati diduga akibat penyakit flu babi Afrika atau african swine fever (ASF). Jumlah itu tercatat sejak Maret hingga pertengahan Juli 2020. Dua ribu ternak yang mati itu tersebar hampir di semua kecamatan di Sumba Timur.Yohanis mengungkapkan, Kecamatan Lewa tercatat dengan angka kematian tertinggi berdasarkan data yang ada di Dinas Peternakan Sumba Timur. Kemudian, disusul Kecamatan Kota Waingapu, Kecamatan Kambera, Kecamatan Wulla Waijelu, dan beberapa kecamatan lainnya.Baca Juga: Menahan laju deforestasi lewat program mata pencaharian alternatif“Awalnya, kami mengira bahwa kematian babi disebabkan oleh penyakit colera. Karena itu, kami dari Dinas Peternakan melakukan vaksinasi, kata Yohanis, kepada Kompas.com, melalui sambungan telepon, Kamis (16/7/2020).Yohanis melanjutkan, babi yang mati di Sumba Timur memiliki gejala limpah membengkak, suhu badan tinggi, tidak mau makan, kemerahan pada kulit, muntah, dan diare. Berdasarkan penampakan klinis tersebut dan jumlah kematian yang sangat tinggi, dugaan pihaknya mengarah ke ASF.“Untuk memastikan penyebab kematian ribuan babi tersebut, pemerintah kini sedang mengambil sampel. Sampel akan dikirim ke Balai Besar Veteriner Denpasar untuk uji laboratorium”, ujar Yohanis.Baca Juga: Jelang Idul Adha, muatan kapal ternak Pelni terus meningkatSebelumnya, pemerintah telah mengambil sampel, tetapi karena pembatasan penerbangan akibat pandemi Covid-19, pengiriman sampel tidak bisa dilakukan. Sejauh ini, tambah dia, pemerintah melalui Dinas Peternakan sudah mengarahkan petugas lapangan untuk melakukan penyemprotan disinfektan di setiap kandang ternak milik warga.Yohanis mengimbau kepada masyarakat yang memiliki ternak babi untuk menjaga sanitasi kandang dan memperhatikan pengelolaan pakan. Selain itu, babi mati yang memiliki gejala seperti ASF agar tidak boleh dikonsumsi. Sebaiknya dikuburkan untuk menekan laju penyebaran virus. “Pakan perlu diperhatikan dengan baik agar daya tahan tubuh babi bisa lebih kuat, ujar Yohanis.Artikel ini telah tayang di Kompas.com dengan judul 2.000 Babi di Sumba Timur Mati, Diduga Diserang Flu Babi AfrikaCek Berita dan Artikel yang lain di Google News;16/07/2020;;
72;N073;ntt;media_indonesia;https://mediaindonesia.com/nusantara/376913/100-ekor-babi-mati-mendadak-di-sikka-diduga-terpapar-virus-afrika;"babi ""mati"" ""jawa barat"" ""2020""";15/10/2024;domestic;14/01/2021 14:07;100 Ekor Babi Mati Mendadak di Sikka Diduga Terpapar Virus Afrika;Bantah-membantah mestinya tidak di ruang publik, di media massa, di medsos, tapi di persidangan.Kedutaan Besar Indonesia di Kamboja memperkirakan dari 72 ribu orang yang tidak terdaftar, mayoritas bekerja dalam perjudian daring ilegal.KABUPATEN Sikka, Nusa Tenggara Timur (NTT), kembali diterpa kasus kematian babi secara mendadak. Ada sekitar 100 ekor babi diperkirakan mati secara mendadak khusus di bulan Januari 2021. Kematian babi tersebut diduga diserang virus African Swine Fever (ASF), atau demam babi Afrika.Kepala Dinas Pertanian Kabupaten Sikka, Mauritz da Cunha kepada mediaindonesia.com, Kamis (14/1) menyatakan, masuk di bulan Januari saja, sudah sekitar 100 lebih ekor babi milik warga Kabupaten Sikka yang mati mendadak. Untuk di Sikka ada dua wilayah yang saat ini banyak kasus kematian babi secara mendadak yakni Kecamatan Koting dan Nelle.Dua kecamatan itu saat ini yang paling banyak kasus kematian babi secara mendadak.  Kematian babi secara mendadak ini diduga diserang virus Afrika atau disebut flu Afrika. Gejala virus afrika pada babi sama seperti gejala hog cholera pada babi, antara lain, panas tinggi, napsu makan berkurang, merah pada bagian tubuh, ungkap Moris.Moris mengatakan, sejak kematian babi secara mendadak yang terjadi di tahun 2020 sekitar 3 ribuan ekor, pihaknya sudah melakukan berbagai kegiatan seperti melakukan sosialisasi dan memeriksa hewan ternak babi di rumah-rumah warga. Bahkan pihaknya sudah melakukan penjagaan secara ketat di setiap perbatasan antar kabupaten hingga di bulan November-Desember tahun 2020 tidak ada lagi kasus kematian babi secara mendadak.Namun justru di bulan Januari 2021, Kabupaten Sikka kembali digegerkan dengan kasus kematian babi secara mendadak. Ia menilai kematian babi secara mendadak diakibatkan dengan ulah papalele kita yang membeli babi dari Kabupaten tetangga yang lagi naik kasus kematian babi.Kabupaten tetangga ini kan lagi naik-naiknya kasus kematian babi mendadak. Sementara di Sikka sudah mulai turun hingga tidak ada lagi kasus. Hal ini dimanfaatkan oleh papale kita untuk membeli babi dari luar dan dijual di Kabupaten Sikka. Babi dari luar papalele ini beli dengan harga murah. Lalu papale ini jual kembali di kita di sini. Apalagi harga jual babi di Sikka sangat mahal sekarang, tandas Moris itu.Menurut dia, babi yang mati mendadak ini lebih banyak warga beli di pasar dan saat ini virusnya sudah menyerang babi yang ada beberapa wilayah ini. Hingga saat ini sudah ada 100 ekor lebih babi di Kabupaten Sikka yang mati mendadak yang diduga terpapar virus Afrika.Saat ini kita mulai turun melakukan pencegahan agar tidak lagi meningkatnya kasus kematian babi di Kabupaten Sikka. Hanya bisa denganBiosecurity atau pengaturan lalu lintas hewan. Biosecurity itu tujuannya kita cegah supaya virus dari luar jangan masuk ke kabupaten atau masuk ke kecamatan atau ke desa atau ke satu kandang yang lain, papar dia.Kepala Desa Nelle Barat Paulus Alus menyampaikan ada sekitar 60 ekor lebih babi milik warganya yang mati mendadak. Jumlah ini melebihi jumlah kematian babi pada tahun 2020 lalu.Petugas Kesehatan Hewan dari Dinas Pertanian Kabupaten Sikka sudah turun ke lokasi dan mengambil sampel babi yang mati untuk diuji di laboratorium dan untuk mengetahui penyebab kematian babi-babi tersebut, pungkas dia (GL/OL-10)Gempa dan tsunami yang pernah melanda Teluk Maumere, Kabupaten Sikka pada 12 Desember 1992 silam masih menyisakan jejak geologi yang patut menjadi pembelajaran.SEKTOR pariwisata sangat potensial untuk menambah pendapatan masyarakat serta meningkatkan kontribusi Produk Domestik Regional Bruto (PDRB) Kabupaten Sikka, Nusa Tenggara Timur (NTT).GUNUNG Lewotobi Laki-laki di Kabupaten Flores Timur, NTT, kembali erupsi dengan tinggi kolom abu seribu meter dari atas puncak pada Jumat 9 Agustus 2024, pukul 12:09 WITA.Saat ini, terpantau pelayanan solar subsidi di Kabupaten Sikka  berjalan normal tidak mengalami kendala maupun antrian yang mengular.GUNUNG Lewotobi Laki-laki di Kabupaten Flores Timur mengalami enam kali Erupsi pada Selasa 9 Juli 2024. Akibat terbawa angin saat erupsi, abu vulkanik melanda 20 Desa di Kabupaten Sikka, NTT.Seorang petani tewas setelah terseret banjir Sungai Ndewu di Desa Masebawa, Kecamatan Paga, Kabupaten Sikka, Nusa Tenggara Timur (NTT). Korban bernama Antonius Wela, 62.Ribuan hewan ternak babi mati mendadak di Parigi Moutong, Poso, dan Morowali Utara, Sulawesi Tengah. Penyebabnya, virus African Swine Fever (ASF) atau demam babi Afrika.Sebanyak 14.756 ekor ternak babi di Luwu Timurm Sulawesi Selatan mati mendadak akibat serangan virus African Swine Fever (ASF) atau flu babi Afrika.Ratusan babi di beberapa daerah mati mendadak diduga akibat Flu Babi Afrika yang sebelumnya telah dikonfirmasi mewabah di Batam. Namun, Menteri Pertanian membantahnya.HINGGA saat ini, kasus flu burung atau Avian Influenza (AI) belum ditemukan di Kota Bandung, Jawa Barat.ADANYA virus babi ini dimanfaatkan oleh pemerintah untuk melakukan banyak kegiatan sehingga terkesan menghamburkan uang.PEMKAB Nagekeo,  NTT menolak bantuan ternak babi dari Direktorat Jenderal Peternakan dan Kesehatan Hewan, Kementerian Pertanian. Alasannya, untuk mencegah masuknya virus babi.Copyright @ 2025 Media Group - mediaindonesia. All Rights Reserved;14/01/2021;;
